demand_id,title,description,user_scenario,demand_type,source_cluster_A,source_cluster_B,related_phrases_count,business_value,status
118,在线XML格式化工具需求,用户需要能够快速、便捷地在线格式化XML代码或文件，以提升代码的可读性和规范性。当前用户可能面临本地开发环境未安装专业工具、需要临时处理XML文件、或在协作中快速分享格式化后的代码等场景。核心痛点是缺乏一个无需安装、即开即用、且支持基本格式化功能的在线解决方案，尤其是在使用如Visual Studio Code等编辑器时，可能希望有更轻量级的辅助工具。,用户希望找到一个在线工具，能够直接对XML代码或文件进行格式化（美化），使其结构清晰、易于阅读和编辑。,other,1047,10470001,9,medium,idea
119,获取JSON数据与文件示例,用户频繁搜索JSON相关的示例、样本和数据文件，表明他们在开发、测试或学习过程中需要现成的、结构正确的JSON实例作为参考或模板。其核心痛点是缺乏高质量、易获取的JSON示例，导致需要自行构建或寻找，效率低下且可能出错。,用户希望快速找到可直接使用或参考的JSON格式示例、样本数据或文件，以用于开发、测试、教学或理解数据结构。,other,1034,10340000,7,medium,idea
120,在线JSON格式化工具需求,用户需要能够在线、免费、便捷地格式化JSON数据的工具。他们通常面对未经格式化的、难以阅读的JSON字符串（如来自API响应或日志文件），手动整理费时费力且易出错。用户的核心诉求是快速将杂乱的JSON转换为结构清晰、缩进规范、可读性高的格式，以便于检查、调试或分享数据。,用户希望找到一个无需安装、操作简单的在线工具，能够快速将杂乱的JSON数据格式化为易于阅读和检查的结构化文本。,other,1034,10340001,8,high,idea
121,免费在线格式转换工具需求,用户频繁搜索“online converter”、“free converter app”等短语，表明他们需要一种便捷、免费且无需下载安装的格式转换解决方案。其核心痛点是希望快速处理文件格式转换问题，但可能面临专业软件收费、操作复杂、需要下载安装或担心在线工具的安全性及质量等问题。用户期望能通过网页或轻量级应用，随时随地完成常见格式的转换。,用户希望找到免费、方便、高效的在线工具或应用，以快速完成各类文件（如文档、音频、视频等）的格式转换，无需安装专业软件。,other,1213,12130000,12,high,idea
122,免费在线文本格式化工具需求,用户需要能够快速、便捷地在线处理文本格式的工具，无需下载安装软件。当前痛点在于，用户可能面临本地软件缺失、付费门槛高、操作复杂或需要跨平台使用等问题。他们希望找到一个功能直接、完全免费、通过浏览器即可访问的解决方案，用于整理、美化或转换纯文本的格式，以满足日常学习、办公或内容创作中的基础排版需求。,用户希望找到免费的在线工具，能够快速对文本内容进行格式化处理，无需安装任何软件。,other,1213,12130001,11,medium,idea
123,AI驱动的免费Logo在线生成工具,用户希望通过AI技术，快速、免费地在线创建Logo。其核心痛点是传统Logo设计流程昂贵、耗时且需要专业技能。用户希望有一个集成了AI能力的在线工具，能够简化设计流程，提供创意建议，并快速生成专业、可定制的Logo方案，以满足个人、初创企业或小型项目的品牌标识需求。,用户希望利用AI技术，无需设计技能或高昂成本，快速生成一个专业、可定制的Logo。,other,1229,12290000,5,high,idea
124,免费在线Logo生成工具需求,用户群体（尤其是初创企业、个人创作者或小型团队）需要一种快速、便捷且零成本的方式来创建品牌标识。他们普遍面临传统设计流程的高昂费用、复杂的软件学习曲线以及外包设计的时间延迟等障碍。通过搜索“免费在线Logo生成器”等关键词，用户的核心诉求是找到一个集成化、易操作的网络平台，能够通过模板、图标库和自定义工具，在几分钟内自主生成专业的Logo设计，从而以极低的门槛启动品牌视觉建设。,用户希望找到一个完全免费、无需下载的在线工具，通过简单操作快速生成一个可用的Logo设计。,other,1229,12290001,7,high,idea
125,寻求免费AI Logo生成工具,用户频繁搜索“free logo generator ai”及相关变体，表明他们希望找到能够免费、快速、便捷地生成Logo的AI工具。其核心意图是无需支付高昂的设计费用或学习复杂的设计软件，通过简单的AI工具输入需求即可自动生成可用的Logo方案。这反映了用户对低成本、高效率、零门槛设计解决方案的强烈需求，痛点集中在传统设计流程的成本、时间和技能门槛上。,用户希望找到一个免费的、基于人工智能的在线工具，能够快速自动生成Logo设计。,other,1229,12290002,7,high,idea
126,获取与理解音效资源,用户频繁搜索“sound effect”及其相关短语，表明他们正在寻找音效资源。同时，存在“is it sound effects or affects”这类拼写/语法辨析查询，揭示了用户在搜索和使用音效时，对专业术语的准确拼写、定义及适用场景存在困惑。他们的核心需求不仅是找到音效，更希望获得清晰、准确的指导和资源聚合，以解决在创作或学习过程中遇到的信息混乱和术语障碍。,用户意图寻找高质量的音效资源，并澄清“sound effect”等相关术语的正确用法与概念，以确保其使用的准确性和专业性。,other,1178,11780000,8,medium,idea
127,寻求声音设计与音频制作的实用技巧,用户频繁搜索与声音设计、音频处理相关的技巧和建议，表明他们希望提升在音频制作、现场调音或声音艺术创作方面的实践能力。其核心痛点是缺乏系统、易上手且能解决实际问题的指导资源，现有信息可能过于零散或理论化，导致学习效率低下，难以快速应用于项目或工作中。,用户希望获取关于声音设计、音频处理及现场调音等方面的实用技巧、建议和最佳实践，以提升制作水平或解决具体问题。,other,1178,11780001,9,medium,idea
128,免费在线转换YouTube视频为MP4格式,用户需要一种简单、免费、无需安装软件的方式，将YouTube平台上的在线视频转换为本地MP4文件。其核心痛点是希望快速获取视频内容以便离线观看、保存或分享，但面临官方限制、付费工具或复杂流程的阻碍。用户通常寻求直接通过浏览器访问的在线转换工具，强调‘免费’和‘便捷’，对转换速度、视频质量保持和操作简易性有较高期待。,用户希望找到免费、便捷的在线工具，将YouTube视频链接转换为MP4格式文件并下载到本地设备。,other,1275,12750000,7,high,idea
129,免费在线MP4视频格式转换,用户需要将各种格式的视频文件快速、方便地转换为MP4格式，这是一个非常普遍且基础的需求。用户的核心诉求是“免费”和“在线”，这表明他们希望无需下载安装专业软件，通过网页即可完成转换，以节省设备存储空间和安装成本。同时，搜索短语高度重复且指向明确，说明用户对转换工具的核心功能（转为MP4）和获取方式（免费、在线）有强烈且一致的期待。,用户希望找到一个免费的在线工具，将其他格式的视频文件转换为通用的MP4格式，以便于播放、分享或存储。,other,1275,12750001,7,high,idea
