demand_id,title,description,user_scenario,demand_type,source_cluster_A,source_cluster_B,related_phrases_count,business_value,status
79,学生演讲技巧与素材需求,用户（主要是学生）需要获取关于演讲的实用技巧和合适的演讲内容素材。他们面临在课堂、比赛或即兴场合下进行演讲的挑战，缺乏系统的指导、现成的参考范例以及应对即兴演讲的有效方法，导致准备效率低下、信心不足或表现不佳。,用户希望快速找到针对学生的演讲技巧指南、演讲范例或素材，以提升演讲准备效率和现场表现。,other,1279,12790001,5,medium,idea
80,寻求演讲构思与开场指导,用户的核心需求是获得关于如何构思和开始一场演讲的指导。从搜索短语来看，用户反复搜索“speech ideas”和“how to speech”，表明他们缺乏演讲内容的灵感和基本的演讲方法知识。特别是“best way to start speech”和“how to ideas for a speech”等短语，揭示了用户对如何找到一个好的切入点、如何组织开场白感到迷茫和焦虑，他们希望获得经过验证的最佳实践和具体可用的想法，以克服从零开始的困难。,用户希望学习如何构思演讲内容，并找到有效的方法或最佳实践来开启一场演讲。,other,1279,12790002,8,high,idea
81,寻求免费、优质的语音与文本互转工具,用户群体在积极寻找能够实现文本转语音（TTS）和语音转文本（STT）功能的工具，尤其关注免费、高质量和易用性。他们频繁搜索“best”、“free”等关键词，表明在众多选择中难以快速找到可靠、效果好且成本低的解决方案。痛点集中在工具质量参差不齐、收费不透明、以及特定场景（如Reddit内容朗读、Word文档处理）下的集成需求未被满足。,用户希望找到一款免费或高性价比、效果出色的语音与文本互转应用程序或软件，用于内容阅读、文档处理或信息输入等场景。,other,1279,12790003,22,high,idea
82,免费在线图表制作工具需求,用户频繁搜索“在线图表工具”、“免费图表制作工具”等短语，表明用户群体存在对无需下载安装、能够快速上手且免费的在线图表绘制工具的强烈需求。其核心意图是寻找一种便捷、零成本的解决方案，以替代传统复杂或付费的图表软件。用户可能面临本地软件安装繁琐、专业工具学习成本高、或现有免费工具功能受限等痛点，急需一个在浏览器中即可访问、操作简单、能满足基础图表制作需求的在线平台。,用户希望找到一款完全免费、无需安装、通过浏览器即可使用的在线图表制作工具，以快速创建各类图表。,other,1259,12590000,13,high,idea
83,寻找免费或优质的图表绘制软件,用户正在积极寻找用于创建图表的软件工具。从搜索短语中高频出现的“free”、“best”等词可以看出，用户的核心诉求是找到一款性价比高（尤其是免费）且功能强大、体验优秀的图表绘制工具。他们可能面临市面上工具繁多、难以选择，或担心付费工具成本过高、免费工具功能受限等问题，需要一款可靠、易用且能满足基本乃至专业绘图需求的解决方案。,用户希望发现并评估免费或公认好用的图表（Diagram）绘制软件或工具，以支持其绘图需求。,other,1259,12590001,7,high,idea
84,创作者对角色特质指南与素材的需求,用户（主要是写作爱好者、作家、编剧等）在创作角色时，需要系统性地理解和定义角色的性格特质。他们面临的主要痛点是缺乏结构化的参考材料，如完整的特质列表、定义解释、具体示例以及可下载的指南文档（如PDF）。这导致角色塑造单薄、缺乏深度或一致性，创作过程效率低下。用户希望通过便捷获取权威、全面的特质指南和实用案例，来辅助角色开发，提升创作质量。,用户希望快速获取关于角色特质（character traits）的详细指南、列表、定义和示例，特别是可下载的PDF格式写作指南，以辅助文学或剧本创作中的角色塑造。,other,1168,11680000,9,medium,idea
85,获取角色推荐信/介绍信模板与范例,用户需要为特定角色（如求职、入学、担保等场景中的被推荐人）寻找推荐信或介绍信的写作范例和模板。他们的核心痛点是缺乏撰写此类正式信函的经验或参考标准，不清楚如何有效地描述角色的品质、能力与成就，以及信函应包含哪些必要部分和正式格式。他们希望获得可直接参考或稍作修改即可使用的具体例子，以确保信函的专业性和说服力。,用户希望找到关于“角色”的推荐信或介绍信的示例、模板或写作参考，以辅助自己撰写或理解此类信函。,other,1168,11680001,6,medium,idea
86,商务及正式信函格式与模板需求,用户需要获取关于如何正确格式化商务信函或正式信函的指导、模板和示例。他们面临的主要痛点是不知道标准信函的结构、布局和格式规范，导致在撰写专业信函时感到困难、耗时且担心格式错误影响专业形象。用户希望有一个清晰、权威且易于使用的参考资源，以快速生成符合行业标准的信函。,用户希望学习如何格式化一封商务或正式信函，并获取可参考的样本、模板和布局指南，以确保信函的专业性和正确性。,other,1168,11680002,15,high,idea
87,求职信模板、范例与格式指导需求,用户正在积极寻找求职信（Cover Letter）的范例、模板和格式指南。他们需要具体的、可参考的样本（尤其是来自真实社区如Reddit的推荐），以及符合当前（如2025年）标准的格式规范。这表明用户在自主撰写求职信时面临困难，缺乏高质量的参考素材和专业的结构指导，担心自己的求职信不够专业或无法吸引招聘者。,用户希望找到高质量、可定制的求职信范例和模板，并了解正确的撰写格式与技巧，以高效地完成一份专业的求职信。,other,1168,11680003,24,high,idea
88,在线免费PDF与Word格式互转,用户需要能够在线、免费地将PDF文件转换为可编辑的Word文档，或将Word文档转换为PDF格式。其核心诉求在于便捷、无需安装软件、快速完成格式转换，以便于文档的编辑、分享或归档。当前痛点可能包括需要下载付费软件、转换后格式错乱、存在使用限制或操作复杂等问题。,用户希望找到一个免费、在线、操作简单的工具，实现PDF与Word文件之间的高质量相互转换。,other,1183,11830000,8,high,idea
89,免费PDF格式转换工具需求,用户频繁搜索免费、便捷的PDF转换工具，核心需求是将PDF文件（特别是表格类PDF）转换为可编辑的Excel等格式，或反向转换。这反映出用户在处理文档时，常遇到格式不兼容、无法编辑或需要整合数据的问题。他们希望找到操作简单、无需付费、在线即可完成的解决方案，以提升工作效率，避免手动重新录入或处理格式混乱的文档。,用户希望找到免费、易用的在线工具，将PDF文件与Excel等格式相互转换，以便编辑、处理数据或分享文档。,other,1183,11830001,10,high,idea
90,在线PDF与JPG格式互转工具,用户频繁搜索免费、在线的PDF与JPG图片格式相互转换的工具。这表明用户存在快速、便捷处理文档与图片格式转换的日常需求，他们可能需要在不同场景（如提交电子文档、编辑图片内容、分享文件）下转换文件格式，但缺乏方便易用且无需安装专业软件或付费的解决方案。核心痛点是寻找一个易于访问、操作简单且成本低的转换服务。,用户希望找到能够免费、在线、快速地将PDF文件转换为JPG图片，或将JPG图片合并/转换为PDF文件的工具。,other,1183,11830002,9,high,idea
91,免费在线图片格式转换需求,用户需要将JPEG、PNG、JPG等常见图片格式进行相互转换，核心诉求是寻找免费、便捷、无需下载软件的在线转换工具。他们可能面临本地软件安装繁琐、付费工具成本高、或对专业软件操作复杂的困扰，希望快速完成格式转换以满足上传、分享或编辑等日常需求。,用户希望找到免费、易用的在线工具，将JPEG、PNG、JPG等图片文件快速转换成所需格式。,other,1183,11830003,10,high,idea
92,新手友好的钩针与缝纫入门教程与图案,大量新手用户搜索钩针编织（crochet）和缝纫（sewing）相关的入门级图案（pattern），特别是毯子（blanket）、上衣（top）等具体项目。他们需要从零开始的、清晰易懂的指导，包括免费或易获取的图案资源、基础教程以及本地或线上便捷的材料获取途径。其核心痛点是缺乏适合初学者的系统性入门指引和高质量、易操作的免费图案资源。,用户希望找到专门为初学者设计的、简单易懂的钩针和缝纫图案与教程，以完成如毯子、上衣等具体手工艺项目，并学习相关基础技能。,other,1087,10870000,47,high,idea
93,新手寻求编织入门指导,用户是编织新手，希望学习最基础的编织技能，如“如何绕线”、“如何编织”等。他们可能对专业术语和基础操作感到困惑，缺乏系统、易懂的学习路径。其核心需求是找到适合零基础、能提供清晰步骤指导的入门资源（如书籍或教程），以克服起步阶段的技能障碍，顺利开始第一个编织项目。,用户想要学习编织的基础知识和操作方法，特别是寻找适合初学者的入门教程或书籍。,other,1087,10870001,5,medium,idea
94,寻找优质人像摄影/绘画服务,用户正在寻找提供人像创作服务的专业人士，无论是摄影还是绘画形式。其核心需求是找到该领域内公认的、高质量的创作者。搜索短语中反复出现“top”和“best”，表明用户不满足于普通选择，而是希望在海量服务提供者中快速筛选出顶尖或口碑最佳的人选，以保障最终作品的质量和满意度。这反映了用户在寻找专业服务时面临的信息筛选和信任建立难题。,用户希望找到并联系在肖像摄影或肖像绘画领域技艺精湛、评价最高的专业人士，以委托其创作个人或家庭肖像作品。,other,1301,13010000,6,medium,idea
95,在线免费人像编辑工具需求,用户正在寻找能够在线使用的、免费的人像照片编辑工具或应用。他们希望有一个便捷的入口，无需下载安装专业软件，就能快速对人像照片进行美化、调整等基础编辑操作。其核心痛点是现有专业软件可能过于复杂、昂贵或需要本地安装，而普通手机应用功能又可能有限或收费。他们需要一个功能聚焦于人像、操作简单且无成本负担的在线解决方案。,用户希望找到一个免费的在线工具或应用，专门用于编辑和美化人像照片。,other,1301,13010001,7,high,idea
96,在线肖像照片生成与免费下载,用户的核心需求是便捷地获取或制作高质量的肖像照片，并希望免费下载使用。从搜索短语可以看出，用户频繁搜索“portrait photo online”、“portrait free download”等，表明他们需要在线工具或平台来生成、编辑或获取肖像图片，同时非常关注“免费”和“在线”的便捷性。其痛点可能在于难以找到高质量的免费肖像资源，或缺乏简单易用的在线肖像制作工具。,用户希望在线寻找、生成或编辑肖像照片，并能够免费下载这些图片用于个人或项目。,other,1301,13010002,21,high,idea
97,Windows系统图片查看器需求,用户主要寻求在Windows系统（特别是Windows 11）上查看图片的解决方案。他们可能对系统自带的图片查看器功能不满意，或需要更便捷地查看特定来源（如Reddit）或格式（如JPG）的图片。痛点包括现有工具功能单一、浏览特定平台图片不便、以及缺乏轻量级专用应用。用户希望有一个集成、快速且易于使用的图片查看工具。,用户希望在Windows电脑上，快速、方便地查看本地图片、Reddit等平台的图片，并可能需要基础浏览功能。,other,1102,11020000,11,medium,idea
98,获取免费、易用的通用文件查看器,用户正在寻找一种通用的“查看器（Viewer）”软件，主要关注其定义、含义以及如何获取。搜索词中频繁出现“free”、“download”、“windows”等词汇，表明用户的核心需求是找到一款能够免费下载、适用于Windows系统（特别是Windows 10）的查看器应用。他们可能对“查看器”这一概念本身不太清晰，需要了解其基本定义和功能，并希望找到一款简单、易获取的解决方案来打开或查看特定格式的文件，而无需购买或使用复杂的大型软件。,用户意图了解“查看器”是什么，并寻找一款免费的、适用于Windows系统的查看器应用程序进行下载和使用。,other,1102,11020001,16,medium,idea
99,寻找Reddit第三方浏览工具,用户正在积极寻找Reddit的替代浏览工具或网站。这表明用户可能对官方Reddit应用或网站的某些体验感到不满，希望找到更便捷、免费或功能独特的第三方浏览方案。他们的核心需求是能够以更优的方式访问和浏览Reddit内容，痛点可能集中在官方平台的广告、界面设计、访问限制或功能缺失上。,用户希望找到能够替代官方Reddit应用或网站的第三方浏览工具，以获得更好的浏览体验。,other,1102,11020002,10,medium,idea
100,Instagram布局功能查找与问题解决,用户频繁搜索Instagram的布局功能位置、变化原因及故障问题，表明用户对Instagram的布局功能（尤其是与Story相关的布局或模板）存在强烈的认知和使用需求。用户可能遇到布局功能突然消失、位置改变、无法正常工作或找不到入口的情况，导致无法顺利创建或编辑内容，产生困惑和挫败感。用户希望明确功能状态、获取使用指导或寻找替代方案。,用户希望找到Instagram的布局功能（特别是用于Story的布局或模板），了解其变化原因，并解决布局功能无法使用或找不到的问题。,other,1048,10480000,17,medium,idea
101,Instagram故事与个人资料匿名查看需求,用户希望在不暴露自身身份的情况下，查看Instagram上私人账户的内容、故事浏览者列表以及个人资料。他们寻求能够匿名浏览、获取故事“最常查看者”信息、甚至购买虚假浏览量以提升表面人气的工具或方法。这反映了用户对隐私保护、社交窥探以及账号影响力包装的复合需求。,用户意图匿名查看Instagram私人账户、故事浏览者列表和个人资料，并可能希望通过购买浏览量来提升账号的可见度或影响力。,other,1048,10480001,23,high,idea
102,Instagram用户寻找并理解Dashboard功能,用户频繁搜索Instagram中的“Dashboard”及其相关概念（如Dashboard Views），表明大量用户不清楚该功能的具体位置、定义或用途。这反映出Instagram平台可能存在功能入口不直观、官方命名与用户认知不符、或相关数据指标（如Views）缺乏清晰解释的问题，导致用户无法有效利用该功能来管理或分析其账户。,用户意图找到Instagram中的Dashboard功能入口，并理解其作用，特别是“Dashboard Views”的具体含义。,other,1048,10480002,5,medium,idea
103,便捷高效的在线视频下载工具需求,用户普遍需要一款能够轻松下载网络视频（尤其是来自YouTube、Reddit等平台）的工具。他们希望工具是免费、易用且高效的，最好能以浏览器扩展或独立应用的形式存在，方便一键操作。当前痛点在于，许多在线视频平台不提供官方下载选项，用户难以保存喜爱的内容以供离线观看或二次使用；而市面上的下载工具质量参差不齐，存在安全风险、操作复杂、下载速度慢或格式不支持等问题，导致用户难以找到可靠、高效的解决方案。,用户希望寻找一款最好用、免费且方便的视频下载工具（如浏览器扩展或App），以便轻松下载在线视频，特别是来自YouTube等平台的内容。,other,1270,12700000,39,high,idea
104,获取电影下载器授权码,用户正在积极寻找能够用于特定电影下载器应用（App）的激活码、授权码或兑换码。这些短语表明用户的核心意图是绕过付费门槛或获取高级功能，以免费或便捷地下载电影。其痛点集中在难以找到有效、免费且安全的授权码，对“最佳”代码的搜索也反映出对代码质量和可靠性的担忧。这揭示了用户在获取数字内容时，对成本、便利性和信任度的综合需求。,用户希望找到并输入有效的授权码（codes），以激活或解锁电影下载器应用的全部功能，从而免费下载电影。,other,1270,12700001,5,medium,idea
105,寻求便捷的格式转换工具,用户频繁搜索与“converter”相关的短语，表明他们正在寻找一种能够快速、轻松地完成文件或数据格式转换的工具或方法。其核心痛点在于不知道如何找到合适的转换器、不了解转换工具的具体使用方法，以及希望转换过程能即时完成。这反映了用户对操作简便性、易得性和效率的强烈需求。,用户希望找到并使用一个简单、快捷的工具或方法来转换文件、媒体或数据的格式。,other,1214,12140000,5,medium,idea
106,了解汽车催化转换器的定义与作用,用户通过搜索“converter in car”、“what does converter do”等短语，表明他们希望明确“催化转换器”在汽车中的具体含义、功能以及位置。其核心痛点是缺乏对汽车关键排放控制部件的基础认知，可能源于车辆故障提示、环保知识学习或日常讨论中遇到该术语。用户需要快速、清晰、权威的解释来消除概念模糊，理解该部件如何工作及其重要性。,用户意图查询汽车催化转换器（Catalytic Converter）的基本定义、在车辆中的功能以及其具体作用。,other,1214,12140001,9,medium,idea
107,快速获取填字游戏线索与答案,用户在玩填字游戏时，遇到特定线索（如“cheap”）卡住，需要快速、准确地找到该线索对应的单词及其字母数量（如5、6、8、11个字母）。他们希望直接根据线索和已知的字母数量或位置（如“3 5”可能表示两个单词的长度）来获取答案，而不是在海量信息中筛选或依赖复杂的解谜过程。当前搜索行为表明，用户对高效、精准的答案查询工具有强烈需求。,用户希望通过输入填字游戏线索（如“cheap”）和已知的字母数量或格式，快速找到对应的正确答案，以解决游戏卡关问题。,other,1116,11160000,6,medium,idea
108,纵横字谜线索查询与解答指导,用户在解决纵横字谜（Crossword）时，遇到特定线索（如“guide”、“tips”、“off”等）难以理解或填写，需要快速获取这些线索的含义、可能的答案或解题技巧。他们的核心痛点是面对零散、模糊或双关的英文线索时缺乏直接的解读指导和答案参考，导致解题过程卡顿，体验受挫。,用户希望查询特定纵横字谜线索的解释、答案提示或解题方法，以顺利完成填字游戏。,other,1116,11160001,11,medium,idea
109,快速获取特定长度填字游戏答案,用户在玩填字游戏（crossword）时，手头有特定的线索（clue）和已知的答案字母数量（如3、4、5个字母），需要快速、准确地找到对应的单词。他们的核心痛点是无法仅凭线索和字母数在脑海中立即想出答案，需要借助外部工具进行查询，以验证猜想或直接获取正确答案，从而顺利推进游戏。,用户希望通过输入填字游戏的线索和答案的字母数量，快速查询到匹配的单词答案。,other,1116,11160002,6,medium,idea
110,解决Firestick设备上Downloader应用安装与使用问题,用户在使用Amazon Firestick设备时，普遍遇到Downloader应用无法找到、安装失败或运行异常的问题。他们希望通过Downloader应用来下载或安装其他内容（如体育应用），但当前面临应用不可用、不显示、不工作等障碍，导致无法顺利获取所需功能，体验受阻。,用户想在Firestick上成功安装并使用Downloader应用，以方便下载或安装其他应用程序或内容。,other,1200,12000000,33,high,idea
111,获取体育直播下载器激活码,用户正在积极寻找能够下载体育直播内容的工具（下载器）的激活码或授权码。其核心需求是免费或低成本地获取可靠、有效的代码，以便解锁下载器功能，观看或保存体育赛事直播。这表明用户可能面临官方订阅费用高、地域内容限制或直播平台不便回看等问题，希望通过第三方下载工具灵活获取体育内容。,用户意图寻找并获取体育直播下载器的免费或优质激活码，以解锁工具功能来下载体育直播视频。,other,1200,12000001,5,medium,idea
112,在线免费字体生成工具,用户需要能够在线快速生成、预览和下载自定义字体的免费工具。他们可能从事设计、内容创作或个人项目，但缺乏专业设计软件或购买字体的预算。痛点包括找不到合适的免费字体、本地字体管理复杂、以及希望快速尝试不同字体风格应用于文本。一个集成的在线生成器能让他们即时看到效果并获取字体文件。,用户希望找到一个免费、便捷的在线工具，能够生成、预览并下载各种风格的字体，用于设计、社交媒体或个性化项目。,other,1283,12830000,15,high,idea
113,在线免费字体编辑器需求,用户需要能够在线访问、无需安装且免费的字体编辑与制作工具。他们希望有一个便捷的平台来设计、修改或创建自定义字体，而无需购买昂贵的专业软件或处理复杂的本地安装流程。当前痛点可能包括离线软件成本高、操作复杂，以及缺乏简单易用的在线替代方案。,用户希望找到一个在线的、免费的字体编辑器或制作工具，以便轻松创建或修改字体。,other,1283,12830001,8,high,idea
114,获取APA格式论文与参考文献示例,用户（主要是学生和研究人员）在撰写学术论文或报告时，需要遵循APA格式规范。他们频繁搜索具体的示例和样本，表明其核心痛点是不知道如何正确应用APA格式的细节规则，尤其是在文内引用、参考文献页的排版以及整体论文结构方面。他们需要直观、权威的参考模板来模仿和验证自己的格式是否正确，以避免因格式错误而影响作业或投稿。,用户希望找到符合APA格式（特别是第7版）的完整论文、参考文献页或具体引用的示例，以作为自己写作和排版的参考模板。,other,1020,10200000,9,high,idea
115,APA格式参考文献页生成与规范,用户在撰写学术论文或报告时，需要创建符合APA格式规范的参考文献页（Resources/References Page）。他们面临的主要问题是不清楚APA格式的具体要求（如标题应使用“Resources”还是“References”），以及如何正确格式化条目。用户希望有一个工具或指引，能快速、准确地生成或校验APA格式的参考文献列表，避免因格式错误而影响文档的专业性。,用户希望明确APA格式中参考文献页的正确命名（Resources vs. References）并获取该页面的标准格式模板或生成工具。,other,1020,10200001,6,medium,idea
116,APA格式入门教程与排版指导,用户（尤其是学术写作新手）需要清晰、易懂的指导，以了解APA格式的基本规则，并能够实际应用该格式来排版自己的论文或文档。他们面临的主要痛点是：对APA格式本身不熟悉、缺乏系统性的入门教程、以及在实际操作（如在Word中设置格式）时遇到困难，导致文档格式不规范，影响学术成果的呈现。,用户希望找到针对初学者的APA格式教程，学习其基本规则，并获取具体的操作指导，以将自己的论文或Word文档正确格式化为APA样式。,other,1020,10200002,7,high,idea
117,获取XML示例文件与数据,用户频繁搜索XML相关的示例、样本文件和文档，表明他们需要现成的XML数据或文件模板作为参考或起点。其核心痛点是缺乏可直接使用或学习的标准XML示例，导致在创建、验证或理解XML结构时效率低下，尤其对于初学者或需要快速原型开发的场景。用户可能希望找到可下载的、结构清晰的XML文件，以节省从头编写的时间并避免格式错误。,用户希望快速找到并下载XML示例文件、样本数据或文档，用于学习、测试或作为项目模板。,other,1047,10470000,8,medium,idea
