demand_id,title,description,user_scenario,demand_type,source_cluster_A,source_cluster_B,related_phrases_count,business_value,status
1,汽车仪表盘符号含义查询,用户频繁搜索汽车仪表盘上各种符号、指示灯的含义和解释。这表明用户在驾驶或检查车辆时，遇到不熟悉的警示灯或图标，需要快速、准确地理解其代表的车况或故障信息，以避免误操作或忽视潜在安全问题。痛点在于仪表盘符号繁多且可能因车型而异，用户难以记忆或即时获取权威解读。,用户希望快速识别并理解汽车仪表盘上出现的符号、指示灯的具体含义和应对措施。,other,1174,11740000,6,high,idea
2,新手友好的Home Assistant仪表板需求,用户（尤其是初学者）在寻找或创建Home Assistant仪表板时，面临信息过载和选择困难。他们需要一个清晰、直观且易于设置的仪表板解决方案，能够快速整合关键信息，避免复杂的配置过程，从而降低智能家居系统的入门门槛，提升管理效率和使用体验。,用户希望找到或创建一个适合初学者的、美观且易于设置的Home Assistant家庭控制中心仪表板。,other,1174,11740001,5,medium,idea
3,理解汽车仪表盘指示灯含义与应对,用户在驾驶时，当仪表盘上出现各种颜色（尤其是黄色）和符号的警告灯时，感到困惑和担忧。他们不清楚这些指示灯的具体含义、代表的故障严重程度以及应该采取何种应对措施（如是否需要立即停车、能否继续行驶、是否需要专业维修）。这种不确定性可能导致用户忽视潜在危险，或对轻微问题过度反应，影响驾驶安全和决策效率。,用户希望快速、准确地识别仪表盘上各种警告灯（特别是黄色警告灯）的含义，了解其代表的潜在问题、紧急程度以及正确的处理方式。,other,1174,11740002,11,high,idea
4,汽车仪表板维修、更换与翻新服务需求,用户主要寻求针对汽车仪表板的修复、更换或翻新服务。从搜索短语可以看出，用户的核心需求是解决仪表板出现的各种问题（如破损、老化、功能故障），并希望找到便捷、经济的解决方案。其痛点不仅在于仪表板本身，更在于如何快速找到可靠、就近且价格合理的服务提供商或DIY维修套件。搜索中频繁出现“near me”和“cheap”，突显了用户对服务可及性与成本的高度敏感。,用户希望找到本地、经济实惠的汽车仪表板维修、更换或翻新服务，或购买DIY维修套件自行处理。,other,1174,11740003,7,high,idea
5,新手寻求免费、易用的在线仪表盘创建与学习,用户（尤其是初学者）希望找到或创建一个在线仪表盘，用于数据可视化或信息展示。他们面临的主要痛点包括：不知道仪表盘在哪里（如在汽车、手机或特定软件中），难以找到免费、易用的创建工具（尤其是能从Excel导入数据的工具），以及缺乏关于仪表盘是什么、为何重要以及如何使用的入门指导和优秀案例参考。这些搜索行为反映出用户对仪表盘有基础需求，但存在认知和使用门槛。,用户希望理解仪表盘的概念与价值，找到仪表盘的位置，并获取免费、简单的工具和教程来创建或查看仪表盘，尤其是面向初学者的案例。,other,1174,11740004,97,high,idea
6,车载仪表盘播放与显示《Dashboard Jesus》歌曲及歌词,用户频繁搜索特定歌曲《Dashboard Jesus》及其歌词，并明确关联到汽车（car）和仪表盘（dashboard）场景。这表明用户希望在驾驶时，能便捷地在车载系统（如中控屏或仪表盘）上播放这首歌曲，并同步查看其歌词。当前痛点可能在于：1. 车载系统或流媒体平台未方便地集成歌词显示功能；2. 用户难以快速找到适配车载环境（如驾驶模式）的该歌曲版本或歌词文件；3. 操作流程繁琐，影响驾驶安全。用户的核心需求是获得一个在驾驶场景下，能轻松访问并享受该歌曲与歌词的一体化解决方案。,用户希望在汽车仪表盘或车载娱乐系统中，播放歌曲《Dashboard Jesus》并同步查看其歌词。,other,1174,11740005,6,medium,idea
7,寻找本地或适合新手的驾驶模拟器,用户正在寻找驾驶模拟器，特别是针对赛车、卡车等车辆的模拟驾驶游戏或训练工具。其核心意图是找到“附近”可用的实体模拟器体验点，或为“初学者”寻找易上手的入门级软件/设备。这表明用户可能面临线下信息不透明、线上产品筛选困难，以及缺乏针对新手的引导等痛点，希望获得便捷、可达且适合学习的模拟驾驶解决方案。,用户希望找到地理位置便利的驾驶模拟器体验场所，或寻找适合初学者的模拟驾驶软件/游戏，以进行娱乐或驾驶练习。,other,1244,12440000,11,medium,idea
8,iOS模拟器在Mac上运行与故障排查,用户主要寻求在Mac电脑上获取、安装或运行iOS模拟器（特别是与Xcode相关的模拟器）的方法，并希望解决模拟器无法正常工作（如启动失败、运行异常）的问题。这表明用户在iOS应用开发或测试过程中，依赖模拟器作为关键工具，但遇到了环境配置或软件本身的技术障碍，影响了开发测试流程的效率。,用户希望在Mac上成功安装、启动并顺畅使用iOS模拟器（尤其是Xcode内置的模拟器），以进行应用开发或测试。,other,1244,12440001,5,high,idea
9,新手友好的飞行模拟器入门指南与评测,用户主要搜索“飞行模拟器”及其相关变体，并明确提及“初学者”、“教程”和“评测”。这表明用户群体是刚接触飞行模拟游戏的新手，他们的核心意图是寻找一款适合入门的飞行模拟软件，并希望获得清晰的上手指南和客观的软件评价，以降低学习门槛和做出购买决策。痛点在于面对复杂的模拟器选项和操作不知如何开始，缺乏系统性的入门指引和可信的参考信息。,用户希望找到一款适合初学者的飞行模拟软件，并获取相关的入门教程和客观评测，以便快速上手和了解软件优劣。,other,1244,12440002,9,high,idea
10,获取年度热门游戏推荐榜单,用户正在积极搜索2024及2025年度最佳或最热门的游戏榜单，涵盖桌面游戏、视频游戏及Xbox等特定平台。这表明用户面临信息过载和选择困难，需要权威、及时且分类清晰的推荐列表来辅助其购买或游玩决策，以避免错过优质游戏或浪费时间在平庸之作上。,用户希望快速找到由专业媒体或社区评选出的、特定年份或平台的最佳游戏排行，以作为消费或体验的参考指南。,other,1244,12440003,9,high,idea
11,寻找附近的模拟器体验场所,用户希望快速找到并前往其所在位置附近的模拟器体验场所（如飞行模拟器、赛车模拟器等）。其核心痛点是缺乏一个集中、便捷的渠道来发现和筛选周边的此类专业体验点，导致信息获取困难，决策成本高，难以规划即兴或计划中的体验活动。,用户意图是定位并前往其地理位置附近的模拟器体验店或娱乐场所，以进行体验或消费。,other,1244,12440004,5,medium,idea
12,PS5平台模拟器游戏需求,用户主要搜索PS5平台上的模拟器游戏，包括通用查询、在线游戏、顶级或最佳游戏推荐以及免费游戏选项。这表明用户希望能在PS5上便捷地找到、筛选并体验高质量的模拟器游戏，但可能面临信息分散、选择困难或对免费内容获取途径不了解的痛点。,用户意图在PS5主机上寻找、发现并游玩模拟器类游戏，包括获取游戏推荐、了解在线功能及寻找免费选项。,other,1244,12440005,9,medium,idea
13,跨平台模拟器游戏获取与运行需求,用户主要搜索“模拟器”相关游戏，并频繁关联“Switch”、“PC”、“Steam”等平台，以及“在线”、“免费”、“下载”等动作。这表明用户的核心意图是寻找能够在不同设备（尤其是从PC到Switch）上运行或获取的模拟器游戏。其痛点在于不清楚哪些模拟器游戏支持跨平台、如何安全免费获取、以及在线运行的具体方法和兼容性。用户可能面临游戏资源分散、平台限制、以及操作复杂的困扰。,用户希望找到并能在PC、Switch等多个平台上运行或获取的模拟器游戏，特别是免费或在线版本，并了解其具体含义和操作方法。,other,1244,12440006,65,high,idea
14,Xbox平台模拟器游戏需求,用户主要搜索Xbox平台上的模拟器游戏，包括Xbox、Xbox 360和Xbox One等不同世代主机。他们不仅寻找此类游戏的存在，更希望发现“最佳”或“顶级”作品，这表明用户在众多选择中面临信息筛选困难，需要权威推荐或高质量列表来辅助决策，以找到符合其兴趣的高品质模拟体验。,用户意图在Xbox系列游戏主机上寻找、发现并筛选出优质的模拟器类游戏。,other,1244,12440007,8,medium,idea
15,下载器连接与错误处理优化,用户在使用下载器时频繁遭遇连接失败和不明错误，导致下载任务无法正常启动或中断。具体表现为下载器卡在“连接中”状态、反复提示“未知错误”或“解析错误”，并可能伴随“检查URL和连接”等错误信息。这些问题的持续出现严重阻碍了用户获取所需文件的核心目标，使其陷入反复尝试却无法解决的挫败中，亟需更稳定、清晰的错误诊断与恢复机制。,用户希望下载器能够稳定连接并成功下载文件，在出现问题时能获得明确、可操作的错误提示以便快速解决。,other,1269,12690000,14,high,idea
16,获取最新下载器激活码/代码,用户频繁搜索“downloader codes”及相关短语，意图寻找用于特定下载器（可能是软件或设备）的激活码、授权代码或快捷指令。用户的核心痛点是难以找到有效、免费且最新的代码列表（特别是针对2025年），他们希望有一个集中、可靠且易于访问的资源，以获取“short codes”、“quick codes”或“best codes”，从而快速激活或解锁下载器的全部功能，避免因无效代码而浪费时间。,用户希望快速找到并验证用于特定下载器（如IPTV下载器等）的有效激活码、免费代码列表或快捷指令，以便顺利使用该工具。,other,1269,12690001,14,medium,idea
17,iPhone用户寻找并安装下载器应用,用户主要意图是在iPhone上寻找、确认和安装名为“Downloader”的应用（特别是由AFTVnews开发的版本）。他们通过搜索“downloader on iphone”、“downloader app for iphone”等短语，表明其核心需求是获取一个能在iOS设备上使用的下载工具。痛点在于不清楚该应用是否存在、如何下载、是否兼容iPhone，以及具体的安装位置和方法。这反映了用户在iOS封闭生态中寻找特定功能应用时的普遍困惑和获取渠道的不明确。,用户想在iPhone上找到并安装“Downloader”应用，以实现在iOS设备上进行文件下载的功能。,other,1269,12690002,10,medium,idea
18,获取特定APK下载器应用,用户频繁搜索特定名称（如“aftvnews”）或通用功能的APK下载器应用安装包。这表明用户可能希望绕过官方应用商店，或寻找特定渠道、版本的应用。其核心痛点是难以在常规渠道找到可靠、安全的特定APK文件，尤其是针对Android设备或特定来源（如AFTVNews）的下载工具。用户需要一种便捷、可信的途径来获取这些安装包，以避免安全风险或版本不匹配问题。,用户意图寻找并下载特定来源（如aftvnews）或通用功能的APK格式下载器应用安装文件。,other,1269,12690003,6,medium,idea
19,寻找最佳安卓下载器应用,用户正在寻找适用于安卓设备的最佳下载器应用。他们面临众多选择，难以判断哪个应用在性能、可靠性、速度或功能上更优。用户的核心需求是快速、高效地下载各类文件，但缺乏明确的评估标准或可靠的推荐来源，导致选择困难，可能下载到低效或不安全的应用。,用户希望找到一款在安卓平台上表现最优的下载器应用，以提升文件下载体验。,other,1269,12690004,6,medium,idea
20,寻找免费安卓下载器应用,用户正在寻找一款名为“downloader”的应用程序，主要针对安卓平台，并强调“免费”属性。这表明用户的核心需求是获取一个能够便捷下载网络内容的工具，同时希望避免付费。其潜在痛点可能包括：不清楚哪款下载器应用可靠安全、担心隐藏费用或广告过多、以及需要确认应用与安卓设备的兼容性。搜索短语较为基础，显示出用户可能处于信息搜集或初步尝试阶段。,用户意图寻找并了解一款适用于安卓设备的、免费的下载器应用程序的具体信息、功能及获取方式。,other,1269,12690005,6,medium,idea
21,免费在线下载工具需求,用户需要一款免费、便捷的在线下载工具，能够直接从网页或链接下载内容，而无需安装复杂的软件。当前用户可能面临下载过程繁琐、工具收费或功能受限、找不到可靠安全的下载网站等痛点，他们希望有一个集成的在线解决方案，操作简单且无需本地安装。,用户想要通过在线工具免费下载网页内容、软件或文件，避免安装本地程序，追求快速便捷的下载体验。,other,1269,12690006,21,medium,idea
22,为PC/Windows平台提供下载器,用户明确需要一款能在个人电脑（特别是Windows系统）上使用的下载器软件。从搜索短语中频繁出现“for pc”和“for windows”可以看出，用户的核心意图是找到与PC平台兼容的下载工具。这可能源于用户发现某些下载器主要面向移动端，或者现有工具在PC上体验不佳、功能缺失。他们需要一个专门为PC环境设计、稳定可靠的下载解决方案。,用户希望找到并下载一款能在Windows操作系统的个人电脑上安装和使用的下载器应用程序。,other,1269,12690007,5,medium,idea
23,寻找在线写作平台与工具,用户群体（如自由职业者、写作爱好者）希望找到集写作、协作、求职于一体的在线平台或工具。他们不仅需要基础的免费写作软件，还渴望加入社区（如俱乐部、小组）以获得支持、资源和潜在的工作机会。当前痛点可能包括难以找到可靠且功能全面的免费工具、缺乏与同行交流的渠道，以及在线写作工作机会分散且不易获取。,用户意图寻找免费的在线写作工具、加入写作社区或小组，并探索在线写作相关的工作机会。,other,1286,12860000,17,medium,idea
24,寻求优质在线与本地代码/文本编辑器,用户（尤其是Mac用户）正在积极寻找和比较各种代码与文本编辑器。他们的核心需求是找到一个功能强大、易于使用且适合自身开发环境的编辑器。从搜索短语可以看出，用户既关注在线编辑器的便捷性，也关注本地编辑器（特别是针对Mac系统）的性能和口碑。这表明用户可能面临现有工具功能不足、跨平台协作不便或对Mac系统原生支持不佳的痛点，需要一站式或分场景的优质编辑器解决方案。,用户希望发现并评估适用于编码或文本编辑任务的最佳工具，尤其关注在线版本和Mac系统下的优秀选择。,other,1286,12860001,11,high,idea
25,寻找编辑/写作类工作机会,用户的核心需求是寻找与编辑和写作相关的职位机会，包括全职、兼职或自由职业。他们可能正在求职、考虑职业转型，或是自由职业者寻找新项目。其痛点在于难以高效地找到地理位置合适、匹配自身技能（如编辑、写作）且类型多样（从全职到自由职业）的工作岗位，搜索过程可能分散且耗时。,用户希望找到本地或远程的编辑、作家类工作职位，并探索相关的职业发展路径。,other,1286,12860002,8,high,idea
26,在线文本编辑器需求,用户频繁搜索“online text editor”、“online word editor”等短语，表明用户希望无需安装本地软件，即可通过浏览器直接访问一个能够编辑文本或类似Word文档的在线工具。其核心痛点是需要在不同设备或场景下快速、便捷地进行轻量级文本编辑，避免依赖特定软件或设备，追求即开即用、易于访问的编辑体验。,用户希望找到一个无需安装、通过网页浏览器即可直接使用的在线文本编辑工具，以方便地进行文档创建与编辑。,other,1286,12860003,6,medium,idea
27,寻找免费易用的在线编辑器,用户频繁搜索“在线编辑器”、“免费编辑器”、“编辑器应用”等短语，表明他们希望找到一款能够便捷访问、无需下载安装且成本低廉的编辑工具。核心痛点是市面上编辑器选择众多，用户难以快速辨别哪些是真正免费、好用且功能满足需求的在线解决方案，尤其关注“哪个编辑器应用最好”这类比较性问题。他们可能需要在网页端或移动端进行轻量级的文本、代码或内容编辑，但被付费门槛、软件下载的复杂性或功能过剩的专业软件所困扰。,用户意图寻找一款免费、易于获取（最好在线使用）、功能实用的编辑器软件或应用，以完成日常的编辑工作或任务。,other,1286,12860004,18,high,idea
28,AI智能体入门教程与指南需求,用户（尤其是初学者）需要系统、易懂的教程和指南来学习如何创建、使用或理解AI智能体（Agent）。他们可能面临缺乏结构化学习路径、现有资料过于分散或专业、以及不知道从何开始构建或应用AI智能体的困境。这些搜索短语表明用户希望获得从基础到实践的指导，可能包括工具推荐、步骤详解或案例参考。,用户希望找到针对初学者的AI智能体教程、指南或创建工具，以系统学习如何构建或使用AI智能体。,other,1291,12910000,12,high,idea
29,AI驱动的智能图片编辑器需求,用户频繁搜索与AI结合的图片、照片编辑器，表明他们不满足于传统编辑工具的手动、复杂操作。其核心意图是寻找能够利用人工智能技术，自动或半自动地完成图片美化、修复、风格转换等任务的工具，以降低专业门槛，提升编辑效率与效果。痛点在于传统工具学习成本高、操作繁琐，且难以达到专业效果。,用户希望找到一款集成AI功能的图片编辑软件，用于快速、智能地编辑和美化图片或照片。,other,1291,12910001,6,high,idea
30,基于图片的AI问答需求,用户希望通过上传图片（如照片、图表、截图等），由AI自动识别图片内容并回答相关问题。这反映出用户在处理视觉信息时，希望快速获取解释、分析或答案，而无需手动描述复杂图像或自行搜索。其核心痛点是传统搜索引擎或聊天机器人难以直接理解非文本的视觉内容，导致信息获取效率低下。,用户希望上传一张图片，让AI识别图片中的内容并直接给出相关问题的答案或解释。,other,1291,12910002,7,high,idea
31,新手友好的免费AI图片生成工具,用户（尤其是初学者）在寻找一款能够免费使用、操作简单且生成效果优秀的AI图片生成器。他们可能对市场上众多的AI工具感到困惑，不确定哪款适合自己，尤其担心付费门槛或复杂的操作流程。核心需求是找到一个易于上手、无需付费且能稳定生成满意图片的解决方案。,用户希望找到一款免费、简单易用且效果好的AI图片生成工具，用于快速创建图片，尤其适合没有经验的初学者。,other,1291,12910003,15,high,idea
32,免费AI图片转视频生成工具需求,用户希望找到能够将静态图片（photo/image）通过AI技术自动转换为动态视频（video）的在线工具或生成器，并且核心诉求是免费使用。这表明用户可能缺乏专业的视频制作技能或昂贵的软件，需要一种简单、快速、零成本的方式，将图片素材转化为更具吸引力的视频内容，用于社交媒体分享、简单演示或创意表达。,用户希望寻找免费、易用的AI工具，将单张或多张图片自动转换成视频。,other,1291,12910004,10,high,idea
33,零经验求职者寻求入门级简历模板与范例,用户主要为缺乏工作经验的初学者，他们需要创建人生第一份简历，但不知从何下手。其核心需求是获取结构清晰、内容详实、可直接参考或稍作修改的简历范例和模板。他们面临的痛点包括不了解简历的标准格式、不清楚如何在没有经验的情况下填充内容，以及希望参考真实有效的成功案例（如Reddit社区分享）来增加求职信心。,用户希望找到专为初学者设计的、包含具体样例的简历模板或范例，以便快速模仿和创建自己的第一份简历。,other,1160,11600000,7,high,idea
34,寻求专业简历版式建议,用户在制作或优化简历时，对版式设计感到困惑，不确定哪种布局（layout）最有效、最专业。他们倾向于在Reddit等社区平台寻求真实用户的经验和推荐，而非官方指南，反映出对主流模板的不信任或对个性化、高通过率版式的迫切需求。核心痛点是缺乏可靠、直观的版式选择指导和成功案例参考。,用户希望找到被社区（如Reddit）认可的最佳简历版式或布局方案，以提升简历的专业性和吸引力。,other,1160,11600001,5,medium,idea
35,新手友好的简历格式与样本需求,用户（尤其是初学者）需要清晰、规范且符合当前趋势（如2025年）的简历格式指导和实际样本。他们缺乏简历制作经验，对如何结构化、排版简历感到困惑，担心格式不当影响求职效果，因此寻求权威、易上手的格式模板和范例来快速创建专业简历。,用户希望找到适合初学者的简历格式模板和样本，学习如何正确格式化简历，以制作出专业、有效的求职简历。,other,1160,11600002,15,high,idea
36,零经验求职者寻求简历模板与格式指导,用户主要为缺乏工作经验的初学者（如应届生或转行者），在制作第一份简历时感到迷茫。他们需要找到适合自身情况（尤其是“无经验”）的简历模板，并希望获得关于如何选择和使用模板（包括Word格式等）的具体指导，以快速创建专业、有效的简历，从而迈出求职第一步。,寻找并选择适合初学者、尤其是无经验者的简历模板，了解最佳格式与使用方法，以高效创建专业简历。,other,1160,11600003,18,high,idea
37,寻找免费在线规划工具,用户频繁搜索与“免费”、“在线”、“下载”相关的规划工具（planner），表明他们希望找到一种无需付费、易于获取且能在线使用的规划解决方案。其核心痛点是市面上许多规划工具需要付费订阅、下载安装复杂，或缺乏便捷的在线协作与访问能力。用户需要一种零成本、低门槛、即开即用的方式来管理个人或简单的工作计划。,用户希望找到并可能下载或直接使用免费的在线规划工具，以替代付费或复杂的软件。,other,1249,12490000,9,medium,idea
38,学生群体在线规划工具需求,学生用户（特别是大学生）正在寻找专门为他们设计的在线规划工具。他们需要一个能够整合学业任务、课程安排和截止日期的数字化规划器，以应对繁忙且多变的校园生活。当前可能缺乏针对学生场景优化的免费或易用工具，导致他们使用通用软件时效率低下，或为专业软件支付高昂费用。核心需求是获得一个便捷、免费且贴合学生日常学习管理流程的在线规划解决方案。,寻找一款专门为学生设计、免费且易于使用的在线规划器或日程管理工具，以更好地组织学业任务和时间。,other,1249,12490001,5,medium,idea
39,寻找高效便捷的规划工具应用,用户正在积极寻找用于个人或工作规划的应用程序。从搜索短语来看，用户不仅关注通用的“规划应用”，还特别在意其可用形态（如桌面端、在线版），并希望找到其中“最佳”或“免费”的选项。这表明用户可能面临现有工具功能不足、平台限制或成本顾虑等痛点，核心需求是获取一个跨平台、功能强大且性价比高的规划解决方案，以帮助其更好地组织任务、管理时间或项目。,用户希望找到一款优秀的规划类应用，可能用于任务管理、日程安排或项目规划，并倾向于免费或跨平台（桌面/在线）的解决方案。,other,1249,12490002,5,medium,idea
