demand_id,title,description,user_scenario,demand_type,source_cluster_A,source_cluster_B,related_phrases_count,business_value,status
40,为iPad寻找优质规划应用,用户正在为iPad设备寻找规划类应用（planner apps），核心需求是找到一款适合在iPad上使用的规划工具。从搜索短语中可以看出，用户不仅关注应用的“最佳”（best）推荐，也考虑“免费”（free）选项，表明他们在寻找功能与成本之间的平衡点。其痛点可能在于从众多应用中难以快速筛选出真正适合iPad大屏、触控操作且体验良好的规划软件，或对现有应用的跨平台同步、手写支持等功能存在疑虑。,用户希望找到并选择一款最适合在iPad上使用的日程规划或笔记类应用，可能用于学习、工作或个人事务管理。,other,1249,12490003,6,medium,idea
41,新手入门计划本选购指南,用户（尤其是计划本使用新手）在初次接触或选购计划本时，面临信息过载和选择困难。他们缺乏系统性的指导，不清楚如何开始使用计划本，也不了解市面上众多产品的区别与优劣，尤其希望找到一款真正适合新手入门、能帮助他们有效建立规划习惯的产品。其核心需求是获得一个清晰、可靠、针对初学者的选购与使用指引。,用户希望找到并购买一款最适合新手入门使用的计划本，并获取相关的使用指导和产品推荐。,other,1249,12490004,8,high,idea
42,Microsoft Planner新手入门教程需求,用户搜索了大量与“Microsoft Planner教程”、“指南”和“初学者”相关的短语，表明新用户或初次接触该工具的用户在开始使用时遇到了困难。他们缺乏一个系统、清晰、从零开始的引导，来理解Planner的基本功能、界面和操作流程。这导致用户无法快速上手并有效利用该工具进行任务或项目管理，可能造成学习成本高、使用效率低下甚至放弃使用。,用户希望找到针对初学者的、易于理解的Microsoft Planner使用教程或指南，以快速学会如何使用该工具的基本功能。,other,1249,12490005,5,medium,idea
43,Mac用户快速输入emoji的需求,大量Mac用户频繁搜索如何在Mac设备上调用和输入emoji表情，表明系统内置的emoji输入方式（如快捷键或键盘布局）对用户而言不够直观、不易发现或操作不便。用户的核心痛点是无法快速、便捷地在文本输入过程中插入emoji，影响了沟通效率和体验。他们需要一种更显性、更易记忆的调用方式。,用户希望在Mac电脑上，能通过简单、快捷的方式（如明确的键盘快捷键或专用键盘按钮）调出并输入emoji表情。,other,1166,11660000,17,high,idea
44,Emoji使用指南与教程需求,用户频繁搜索与“emoji guide”、“tutorial”相关的短语，表明他们需要系统性的指导来理解和使用表情符号。其核心痛点在于缺乏一个清晰、全面的资源，来解读不同emoji的含义、学习在各种设备（如键盘、PC）上快速输入emoji的方法，以及了解其使用规范和最佳实践。用户希望获得从基础到进阶的实用指引，以提升数字沟通的效率和准确性。,用户希望找到一份全面的指南或教程，以理解emoji的含义，并学习如何在电脑和键盘上高效地输入与使用它们。,other,1166,11660001,7,medium,idea
45,在线表情符号制作与下载工具,用户需要能够在线快速生成、定制和下载表情符号的工具或应用，同时希望获得免费、便捷的体验。他们可能面临现有表情符号库单调、无法个性化定制，或者下载过程繁琐、需要付费等问题。此外，用户还希望有相关的娱乐功能，如表情符号游戏，以增加趣味性。,用户希望找到免费、易用的在线平台，用于创建、下载和使用个性化的表情符号，并可能探索相关的游戏或字体生成功能。,other,1166,11660002,26,high,idea
46,在线使用或添加表情符号键盘,用户频繁搜索与“emoji keyboard”相关的短语，核心意图是寻找在线表情符号键盘工具，或解决在设备（尤其是键盘）上输入、使用、添加表情符号的具体操作问题。用户可能不熟悉如何在特定平台或设备上调用表情符号，或希望找到无需安装的在线解决方案。其痛点集中在操作路径不明确、找不到便捷的输入工具以及对于“如何操作”的普遍困惑。,用户希望找到在线表情符号键盘，或学习如何在键盘上输入、添加和使用表情符号。,other,1166,11660003,12,medium,idea
47,厘清图表、图形与表格的核心区别,用户频繁搜索“chart vs graph vs table”等对比短语，表明他们在面对多种数据可视化形式时，存在概念混淆和选择困难。其核心痛点是无法清晰理解图表（chart）、图形（graph）、示意图（diagram）及表格（table）之间的本质区别、适用场景及命名差异，这导致他们在学习、工作汇报或数据分析时，难以准确选择或描述最合适的信息呈现方式，影响沟通效率和专业度。,用户希望明确图表（chart）、图形（graph）、示意图（diagram）和表格（table）这几类常见数据与信息呈现形式的具体定义、区别与联系。,other,1257,12570000,9,medium,idea
48,新手图表制作入门教程与指南,"用户（尤其是初学者）在Excel、Google Sheets等常见办公软件中制作图表时，缺乏系统、易懂的入门指导。他们搜索的关键词高度集中于“graph tutorial”和“guide”，并明确关联到具体平台（如Excel, Google Sheets）和场景（如Codeforces），表明其核心痛点是面对图表功能时不知从何下手，需要针对特定工具和场景的、从零开始的步骤化教学，而非零散的功能介绍。",用户希望找到针对Excel、Google Sheets等具体工具的、面向初学者的图表制作分步教程或指南，以快速掌握基础图表的创建方法。,other,1257,12570001,12,high,idea
49,在线获取可打印的网格纸,用户需要能够在线查找、访问并打印免费的网格纸（Graph Paper）。其核心诉求是便捷地获得标准或可定制的网格纸模板，并能够直接打印或下载为PDF格式，以满足学习、工作或绘图中的即时需求。痛点主要在于寻找可靠、免费且无需复杂操作即可打印的资源。,用户希望快速找到免费的、可打印的网格纸资源，以便在线使用或下载后打印。,other,1257,12570002,9,medium,idea
50,寻求简单易用的数学绘图工具,用户频繁搜索与“graph”和“math”相关的短语，并伴有“simple”和“help”等意图词。这表明用户的核心需求是找到一个操作简单、易于上手的工具或方法来绘制数学图形（如函数图像、几何图形等）。他们可能面临现有绘图工具过于复杂、学习成本高，或在数学学习中难以快速将抽象概念可视化的问题，急需一个能降低门槛、提供明确帮助的解决方案。,用户希望找到或使用一个简单、直观的工具来绘制数学图形，以辅助数学学习或问题解决。,other,1257,12570003,5,medium,idea
51,免费在线数学绘图工具需求,用户频繁搜索“在线图表”、“免费图表”等短语，表明他们需要一个能够便捷、免费地在网页端创建和操作图表的工具。其核心痛点在于，许多现有工具或软件需要下载安装、付费订阅，或者功能过于复杂，无法快速满足数学学习、简单数据可视化等基础需求。用户希望有一个即开即用、操作直观的在线平台来完成图表绘制任务。,用户希望找到一个无需下载、免费使用的在线工具，以便快速创建和编辑数学或数据相关的图表。,other,1257,12570004,5,high,idea
52,在线免费图表制作工具需求,用户需要能够快速、便捷地在线创建图表，且希望工具是免费的。从搜索短语中高频出现的“free”、“online”、“maker”可以看出，用户的核心诉求是找到一个无需下载安装、无需付费、操作简单的网络工具来生成图表。他们可能面临传统图表软件昂贵、复杂、需要本地安装等痛点，急需轻量级、易访问的解决方案。,用户希望找到一个免费的在线工具，能够快速创建图表，无需复杂安装或付费。,other,1257,12570005,9,high,idea
53,获取教程类趣味梗素材,用户频繁搜索与“教程”和“梗”结合的短语，表明他们希望找到一种特定类型的趣味内容。这类内容通常以“教程”为形式或外壳，但核心是娱乐性的“梗”，并常与音乐、歌曲、GIF或视频等多媒体元素结合。用户的深层意图并非学习严肃技能，而是寻找轻松、幽默、易于传播和二次创作的网络文化素材。当前痛点可能在于这类内容分散在多个平台，格式不一，且高质量或特定主题的素材难以直接获取。,用户希望轻松找到并下载以“教程”为形式的趣味梗内容，特别是与音乐、视频或GIF结合的素材，用于娱乐、社交分享或二次创作。,other,1199,11990000,10,medium,idea
54,寻求Meme制作技巧与规范指南,用户频繁搜索与“meme”和“tips”、“guide”、“guidelines”相关的短语，表明他们希望获得关于如何制作、编辑或优化Meme的实用技巧、步骤指南或设计规范。其核心痛点在于缺乏系统性的创作指导，可能面临不知如何选择工具、如何设计更有效果、或如何遵循特定平台模板规范等问题，需要从基础操作到进阶优化的全方位指引。,用户想要学习如何制作或优化Meme，寻找具体的技巧、步骤指南或设计规范模板。,other,1199,11990001,10,medium,idea
55,快速制作顶部/底部文字梗图,用户希望有一个便捷的工具，能够快速为图片（尤其是梗图模板）添加上下两行文字（即“顶部文字”和“底部文字”），以制作和分享流行的“顶部文字 底部文字”格式的梗图。当前用户可能依赖多个步骤或不同工具组合来完成，过程繁琐，缺乏一站式、模板化、操作直观的解决方案。,用户想要寻找或使用一个工具，能轻松创建带有顶部和底部说明文字的流行梗图（meme）。,other,1199,11990002,6,medium,idea
56,免费在线模因生成与编辑工具,用户主要寻求能够快速、免费地在线制作或编辑模因（meme）的工具。他们关心模因模板的获取、编辑器的易用性以及是否免费。痛点包括找不到合适的模板、工具收费或操作复杂，以及缺乏便捷的字体等定制功能。用户希望有一个集成模板库、简单编辑器且完全免费的解决方案，以满足日常社交分享或娱乐需求。,用户想要找到一个免费、易用的在线工具，用于搜索模因模板、生成或编辑自定义模因，并可能关注字体等细节调整。,other,1199,11990003,42,high,idea
57,识别与获取网络梗图常用字体,用户在浏览或制作网络梗图（memes）时，经常遇到特定风格的字体，这些字体是梗图文化的重要组成部分，能有效传达幽默或讽刺的意味。用户的核心需求是快速、准确地识别出这些在梗图中频繁出现的字体名称，并希望知道如何获取或使用它们，以便在自己的创作中复现相同的风格效果。目前，用户可能面临无法通过视觉直接辨认字体、搜索关键词不准确导致找不到正确结果，或不知道去哪里下载/使用这些特定字体的痛点。,用户希望通过搜索，找到在流行梗图中看到的特定字体的名称、来源或下载方式。,other,1199,11990004,5,medium,idea
58,免费AI语音/角色语音生成工具需求,用户正在寻找能够免费生成语音或角色语音的AI工具。从搜索短语中高频出现“free”、“generator”、“ai”、“voice”、“character”等词可以看出，用户的核心诉求是无需付费、操作简便地利用人工智能技术，将文本转换为自然流畅的语音，特别是为特定角色（如虚拟角色、游戏角色、视频配音角色）生成具有辨识度的声音。这反映出用户可能面临专业语音合成软件成本高、操作复杂，或难以找到高质量免费替代方案的痛点。,用户希望找到免费、易用的AI工具，将文本转换成语音，并特别关注为特定角色生成独特声音的功能。,other,1276,12760000,12,high,idea
59,在线AI音频/声波生成工具,用户需要能够在线便捷生成各类声音、音频或声波的工具。从搜索短语来看，用户的核心诉求是“生成”，并强调“在线”和“AI”，这表明用户希望无需下载专业软件，通过智能、自动化的方式快速创建或合成声音内容。其痛点可能在于传统音频制作软件复杂昂贵，或缺乏简单直接的创意声音生成手段。,用户希望找到一个在线平台或工具，能够通过AI技术快速、简单地生成特定的声音、音频文件或声波图案。,other,1276,12760001,7,medium,idea
60,免费在线音频编辑工具需求,用户需要能够直接在网页浏览器中使用的免费音频编辑工具，无需下载安装专业软件。他们希望快速、便捷地对音频文件进行剪辑、合并、调整音量等基础编辑操作，以满足日常内容创作、学习或娱乐需求。痛点在于专业软件昂贵复杂，而现有在线工具可能功能有限或收费。,用户希望找到一款免费、易用的在线音频编辑器，能够快速完成基础的音频剪辑与处理任务。,other,1276,12760002,14,high,idea
61,AI辅助歌曲生成工具,用户希望找到能够利用人工智能技术，快速、便捷地生成原创歌曲或音乐片段的在线工具。其核心痛点是缺乏专业的音乐制作技能、设备或知识，但仍有强烈的创作欲望或内容制作需求。他们需要一种低门槛、甚至免费的方式，将创意或想法转化为初步的音乐作品，用于个人娱乐、内容创作或灵感激发。,用户意图寻找免费、易用的AI工具，输入简单指令或想法，自动生成完整的歌曲或音乐伴奏。,other,1276,12760003,8,high,idea
62,免费在线音乐创作工具需求,用户希望找到能够免费在线使用的音乐或歌曲制作工具。他们可能缺乏专业的音乐制作软件或不愿承担高昂的购买费用，同时追求便捷、无需安装的在线体验。核心需求是能够快速、低成本地开始音乐创作，进行简单的作曲、编曲或录制。,用户意图寻找免费、易用的在线平台或软件，用于创作音乐或歌曲。,other,1276,12760004,10,high,idea
63,面向初学者的科学计算器使用指导,用户（尤其是初学者）在寻找科学计算器时，不仅需要找到工具本身，更迫切地需要了解如何正确使用它。他们可能面对功能复杂的科学计算器界面感到困惑，不清楚各种高级函数（如三角函数、对数、指数）的按键位置和操作逻辑，或者担心在线上使用时的可靠性与准确性。其核心需求是通过清晰的教程或引导，降低学习门槛，快速掌握科学计算器的基本操作，以完成学习或工作中的计算任务。,用户希望找到一款适合初学者的科学计算器，并获取清晰的使用教程或引导，以学习其基本功能和操作方法。,other,1258,12580000,6,medium,idea
64,便捷的移动端小费计算器需求,用户频繁在手机（尤其是iPhone）上搜索计算器，特别是小费计算功能。这表明用户在日常消费场景（如餐厅、打车后）需要快速、便捷地计算小费金额。痛点在于系统内置计算器可能没有专门的小费计算功能，或者用户找不到该功能的位置，导致计算不便、效率低下。用户希望有一个易于访问、操作简单、免费的小费计算工具，可能以独立App或集成在系统计算器中的形式存在。,用户希望在手机（特别是iPhone）上快速找到并使用计算器，尤其是能方便地计算小费金额。,other,1258,12580001,16,medium,idea
65,免费计算器应用下载需求,用户主要意图是寻找并下载免费的计算器应用程序。从搜索短语来看，用户明确强调“免费”，并频繁使用“download”和“app”，表明其核心需求是快速、零成本地获取一个计算器工具。部分搜索涉及“pc”，说明用户可能需要在不同设备（尤其是移动设备和电脑）上使用。痛点可能包括：市场上付费应用过多，难以筛选；对应用的安全性、广告干扰存在顾虑；以及跨平台使用的便捷性不足。,用户希望免费、便捷地下载一个计算器应用，可能用于移动设备或电脑，以满足日常计算需求。,other,1258,12580002,9,medium,idea
66,提供简单易用的在线基础计算器,用户频繁搜索“在线计算器”、“简单计算器”等短语，表明他们需要一个能通过浏览器快速访问、无需下载安装、界面简洁、操作直观的基础计算工具。其核心痛点是现有计算工具可能过于复杂、带有广告干扰、加载缓慢或功能冗余，用户只希望进行简单的算术运算，需要一个即开即用、专注核心功能的解决方案。,用户希望找到一个界面干净、操作直接、功能基础的在线计算器，用于快速完成日常算术计算。,other,1258,12580003,7,high,idea
67,免费在线计算器需求,用户频繁搜索“免费”、“在线”、“基础”等关键词组合的计算器，表明用户希望无需下载、注册或付费，就能通过网页快速访问一个基础功能的计算工具。其核心痛点是希望避免安装软件、规避付费门槛，并追求即开即用的便捷性。这反映了用户对轻量化、零成本、易获取的基础计算服务的普遍需求。,用户希望找到一个无需下载、注册或付费，通过浏览器就能直接使用的在线基础计算器。,other,1258,12580004,8,high,idea
68,寻求免费、在线的制作工具或应用,用户频繁搜索与“maker”相关的免费、在线应用或工具。这表明用户的核心需求是寻找一个能够便捷创建或制作内容的平台，且该平台无需下载安装（在线即可使用）或无需付费。用户可能对现有工具的付费门槛、下载安装的复杂性或功能限制感到不满，希望找到简单易用、无成本负担的解决方案。这些搜索短语高度同质化，指向一个明确且集中的需求。,用户希望找到一个免费、无需安装、通过网页或应用即可直接使用的在线内容制作工具或平台。,other,1220,12200000,10,high,idea
69,用户对“创作者”概念与账户的认知与访问需求,用户频繁搜索“creator”相关短语，表明他们希望理解“创作者”这一概念的定义、起源（如“第一个创作者是谁”）以及具体平台（如Reddit）上的创作者账户信息。其核心意图是获取关于“创作者”的权威解释和访问相关账户的途径。痛点在于“创作者”一词可能含义模糊，缺乏明确的官方定义或背景介绍；用户可能找不到特定平台（如Reddit）创作者账户的登录入口或专属页面；同时，对“创作者”身份的起源和演变存在认知空白，缺乏系统性的知识来源。,用户希望明确“创作者”的定义，了解其背景，并找到特定平台（如Reddit）上创作者账户的相关信息或登录方式。,other,1220,12200001,13,medium,idea
70,寻求免费或低成本的创作者工具,用户频繁搜索与“creator”相关的免费、在线或应用程序版本，并关注“pilot program”（试点项目）。这表明用户的核心意图是寻找低成本或免费的创作工具或平台。他们的痛点可能包括：付费工具门槛高、不确定工具是否适合自己、希望先免费试用再决定。用户希望找到一种易于获取、可能通过试用项目体验的解决方案，以支持其创作活动。,用户希望找到免费、在线或可通过试点项目体验的创作者工具或应用程序，以低成本开始或进行创作。,other,1220,12200002,9,medium,idea
71,在线免费角色创建工具,用户需要一个能够在线访问、免费使用的角色创建器或角色制作工具，用于快速生成角色设定或角色卡。当前痛点可能包括：需要下载安装软件、付费才能使用完整功能、或工具操作复杂、模板不够灵活。用户希望有一个便捷、无门槛的解决方案，能够随时随地进行角色创作。,用户希望找到一个在线的、免费的工具，用于创建和定制角色（可能用于游戏、写作、设计等场景）。,other,1220,12200003,6,high,idea
72,在线DND/5e角色卡创建与管理工具,用户（主要是桌面角色扮演游戏玩家）需要能够在线便捷地创建、填写、管理和分享其游戏角色卡（Character Sheet）的工具。当前痛点在于，玩家可能依赖纸质表格或静态模板，存在易丢失、不便携带、计算复杂（如DND 5e规则下的属性计算）以及难以与队友在线共享和更新角色状态的问题。用户希望获得一个集成了规则模板（如DND 5e）、提供示例参考、支持在线编辑与保存的数字化解决方案。,用户希望找到一个在线的、最好是免费的工具或模板，用于快速创建、填写和存储他们的桌面角色扮演游戏（如D&D 5e）的角色卡，并可能参考示例或使用预设模板。,other,1220,12200004,12,high,idea
73,AI面部美化与造型建议,用户（尤其是年轻女性和模特等对形象有较高要求的群体）寻求通过AI技术获得个性化的面部护理、化妆或造型建议。他们可能缺乏专业的美容知识，难以找到适合自己脸型、肤质或场合的针对性方案，希望获得便捷、智能且可靠的形象指导。,用户希望通过AI工具获取针对个人面部特征（如脸型、肤质）的护理、化妆或模特造型方面的专业建议和技巧。,other,1071,10710000,6,medium,idea
74,在线人脸搜索与查找,用户希望通过互联网快速、免费地搜索和识别特定人脸。他们可能拥有一张照片或图像，但缺乏相关身份信息，希望借助在线工具或平台（如Reddit社区）来查找该人物的更多资料或确认其身份。当前痛点在于缺乏一个整合、易用且免费的专门人脸搜索引擎，导致查找过程繁琐、信息分散且结果不可靠。,用户意图通过在线工具或社区，输入人脸图像，快速查找并识别该人物的身份或相关信息。,other,1071,10710001,6,medium,idea
75,跨平台使用FaceTime的需求,用户希望了解和使用苹果的FaceTime功能，尤其是在非苹果设备（如Android手机）或不同苹果设备（如iPad、iPhone）之间进行视频或音频通话。核心痛点是FaceTime作为苹果生态内的封闭服务，官方不支持Android平台，导致跨平台通信存在障碍。用户搜索如何让FaceTime在Android上工作、如何进行音频通话以及在不同设备上使用的具体方法，反映了对跨平台便捷视频/音频通话工具的强烈需求。,用户想要在Android设备或不同苹果设备上使用FaceTime进行视频或音频通话，以解决跨平台通信不便的问题。,other,1071,10710002,13,high,idea
76,免费在线AI人脸替换与美化工具,用户希望找到能够在线免费使用、操作简便的人脸替换（Face Swap）或面部美化（类似Facetune）的AI工具或应用。他们可能不愿下载安装独立应用，或希望快速、无成本地体验AI换脸效果，用于娱乐、社交内容创作或简单修图。核心需求集中在“免费”、“在线”、“AI驱动”和“易用性”上。,用户希望无需下载安装，直接在网页上免费使用AI技术进行人脸替换或面部美化处理。,other,1071,10710003,16,medium,idea
77,寻求面部相关应用或网站的评测信息,用户频繁搜索与“face review”相关的短语，表明他们正在积极寻找关于面部应用、网站或AI工具的评测、评论或解释信息。其核心意图是希望在下载、使用或购买与面部处理相关的产品或服务前，了解其功能、效果、可靠性或用户反馈，以辅助决策。这反映出用户面临信息筛选困难、对产品质量存疑或对新兴概念（如AI）理解不足的痛点。,用户希望查找并参考关于面部应用、网站或AI工具的第三方评测、评论或含义解释，以评估其是否值得使用或信任。,other,1071,10710004,7,medium,idea
78,移动端语音与文本互转需求,用户需要在Android设备上实现语音与文本之间的便捷、准确转换，尤其关注免费、高效的工具或方法。他们可能面临输入效率低、操作复杂、付费门槛或识别准确率不足等痛点，希望通过简单的语音输入快速生成文本，或将文本转换为语音进行播放，以提升移动场景下的信息处理效率。,用户希望找到在Android设备上免费、易用的语音转文本或文本转语音的解决方案，以简化输入或输出过程。,other,1279,12790000,9,high,idea
