种子关键词,下拉词建议,排名,扩展类型,扩展词,语言,地区,状态
cartoon network,cartoon network us,4,alphabet,u,en,US,success
cartoon network,cartoon network uk schedule,5,alphabet,u,en,US,success
cartoon network,cartoon network universe,6,alphabet,u,en,US,success
cartoon network,cartoon network unblocked,7,alphabet,u,en,US,success
cartoon network,cartoon network usa schedule,8,alphabet,u,en,US,success
cartoon network,cartoon network upcoming shows,9,alphabet,u,en,US,success
cartoon network,cartoon network unikitty,10,alphabet,u,en,US,success
cartoon network,cartoon network xfinity,1,alphabet,x,en,US,success
cartoon network,cartoon network xfinity channel number,2,alphabet,x,en,US,success
cartoon network,cartoon network xd,3,alphabet,x,en,US,success
cartoon network,cartoon network xfinity channel,4,alphabet,x,en,US,success
cartoon network,cartoon network x,5,alphabet,x,en,US,success
cartoon network,cartoon network x nickelodeon,6,alphabet,x,en,US,success
cartoon network,cartoon network xbox 360 games,7,alphabet,x,en,US,success
cartoon network,cartoon network xbox 360,8,alphabet,x,en,US,success
cartoon network,cartoon network xfinity 2025,9,alphabet,x,en,US,success
cartoon network,cartoon network xavier renegade angel,10,alphabet,x,en,US,success
cartoon network,cartoon network villains,1,alphabet,v,en,US,success
cartoon network,cartoon network vs nickelodeon,2,alphabet,v,en,US,success
cartoon network,cartoon network video games,3,alphabet,v,en,US,success
cartoon network,cartoon network videos,4,alphabet,v,en,US,success
cartoon network,cartoon network vhs,5,alphabet,v,en,US,success
cartoon network,cartoon network voice actors,6,alphabet,v,en,US,success
cartoon network,cartoon network vs nickelodeon vs disney,7,alphabet,v,en,US,success
cartoon network,cartoon network vs boomerang,8,alphabet,v,en,US,success
cartoon network,cartoon network vintage shirt,9,alphabet,v,en,US,success
cartoon network,cartoon network vs nickelodeon shows,10,alphabet,v,en,US,success
cartoon network,cartoon network tv schedule,2,alphabet,t,en,US,success
cartoon network,cartoon network toonami,3,alphabet,t,en,US,success
cartoon network,cartoon network tv shows 2000s,4,alphabet,t,en,US,success
cartoon network,cartoon network tier list,5,alphabet,t,en,US,success
cartoon network,cartoon network t shirts,6,alphabet,t,en,US,success
cartoon network,cartoon network toys,7,alphabet,t,en,US,success
cartoon network,cartoon network tko,8,alphabet,t,en,US,success
cartoon network,cartoon network theme park,9,alphabet,t,en,US,success
cartoon network,cartoon network theme song,10,alphabet,t,en,US,success
cartoon network,cartoon network wiki,1,alphabet,w,en,US,success
cartoon network,cartoon network website,2,alphabet,w,en,US,success
cartoon network,cartoon network where to watch,3,alphabet,w,en,US,success
cartoon network,cartoon network wrestling show,4,alphabet,w,en,US,success
cartoon network,cartoon network witch movie,5,alphabet,w,en,US,success
cartoon network,cartoon network wedgies,6,alphabet,w,en,US,success
cartoon network,cartoon network wikipedia,7,alphabet,w,en,US,success
cartoon network,cartoon network website games,8,alphabet,w,en,US,success
cartoon network,cartoon network wallpaper,9,alphabet,w,en,US,success
cartoon network,cartoon network west,10,alphabet,w,en,US,success
cartoon network,cartoon network zim,1,alphabet,z,en,US,success
cartoon network,cartoon network zombie,2,alphabet,z,en,US,success
cartoon network,cartoon network zoids,3,alphabet,z,en,US,success
cartoon network,cartoon network zero gravity,4,alphabet,z,en,US,success
cartoon network,cartoon network zombie show,5,alphabet,z,en,US,success
cartoon network,cartoon network zone,6,alphabet,z,en,US,success
cartoon network,cartoon network zatch bell,7,alphabet,z,en,US,success
cartoon network,cartoon network zombie day,8,alphabet,z,en,US,success
cartoon network,cartoon network z,9,alphabet,z,en,US,success
cartoon network,cartoon network zip,10,alphabet,z,en,US,success
cartoon network,cartoon network youtube,1,alphabet,y,en,US,success
cartoon network,cartoon network yugioh,2,alphabet,y,en,US,success
cartoon network,cartoon network youtube tv,3,alphabet,y,en,US,success
cartoon network,cartoon network yes era,4,alphabet,y,en,US,success
cartoon network,cartoon network yellow dog,5,alphabet,y,en,US,success
cartoon network,cartoon network youtube channel,6,alphabet,y,en,US,success
cartoon network,cartoon network yellow characters,7,alphabet,y,en,US,success
cartoon network,cartoon network you are here,8,alphabet,y,en,US,success
cartoon network,cartoon network yes,9,alphabet,y,en,US,success
cartoon network,cartoon network yumi,10,alphabet,y,en,US,success
cartoon network,which cartoon network character are you,1,question,which,en,US,success
cartoon network,which cartoon network show made the most money,3,question,which,en,US,success
cartoon network,which cartoon network show has the most seasons,4,question,which,en,US,success
cartoon network,which cartoon network show has the most episodes,5,question,which,en,US,success
cartoon network,which cartoon network show are you,6,question,which,en,US,success
cartoon network,which cartoon network shows are coming back,7,question,which,en,US,success
cartoon network,which cartoon network show is the best,8,question,which,en,US,success
cartoon network,which cartoon network,9,question,which,en,US,success
cartoon network,who cartoon network,1,question,who,en,US,success
cartoon network,which cartoon network shut down,2,question,who,en,US,success
cartoon network,which cartoon network character,3,question,who,en,US,success
cartoon network,who owns cartoon network,4,question,who,en,US,success
cartoon network,who bought cartoon network,5,question,who,en,US,success
cartoon network,who created cartoon network,6,question,who,en,US,success
cartoon network,who founded cartoon network,7,question,who,en,US,success
cartoon network,who is cartoon network mascot,8,question,who,en,US,success
cartoon network,who hacked cartoon network,9,question,who,en,US,success
cartoon network,who is ceo of cartoon network,10,question,who,en,US,success
cartoon network,can cartoon network,1,question,can,en,US,success
cartoon network,does cartoon network still exist,2,question,can,en,US,success
cartoon network,does cartoon network shut down,3,question,can,en,US,success
cartoon network,will cartoon network shut down,4,question,can,en,US,success
cartoon network,does cartoon network own adult swim,5,question,can,en,US,success
cartoon network,will cartoon network come back,6,question,can,en,US,success
cartoon network,does cartoon network have a streaming service,7,question,can,en,US,success
cartoon network,does cartoon network still make shows,8,question,can,en,US,success
cartoon network,does cartoon network support israel,9,question,can,en,US,success
cartoon network,does cartoon network exist,10,question,can,en,US,success
cartoon network,is it cartoon network shutting down,1,question,is it,en,US,success
cartoon network,is it cartoon network,2,question,is it,en,US,success
cartoon network,is cartoon network gone,3,question,is it,en,US,success
cartoon network,is cartoon network dead,4,question,is it,en,US,success
cartoon network,is cartoon network shutting down 2024,5,question,is it,en,US,success
cartoon network,is cartoon network closed,6,question,is it,en,US,success
cartoon network,is cartoon network still running,7,question,is it,en,US,success
cartoon network,is cartoon network shutdown,8,question,is it,en,US,success
cartoon network,is cartoon network still around,9,question,is it,en,US,success
cartoon network,is cartoon network ending,10,question,is it,en,US,success
cartoon network,will cartoon network make new shows,3,question,will,en,US,success
cartoon network,will cartoon network ever come back,4,question,will,en,US,success
cartoon network,will cartoon network shows be on netflix,5,question,will,en,US,success
cartoon network,will cartoon network be on netflix,6,question,will,en,US,success
cartoon network,will cartoon network be owned by netflix,7,question,will,en,US,success
cartoon network,will cartoon network shows come to netflix,8,question,will,en,US,success
cartoon network,will cartoon network come back to max,9,question,will,en,US,success
cartoon network,will cartoon network come to netflix,10,question,will,en,US,success
cartoon network,does cartoon network still air,5,question,does,en,US,success
cartoon network,does cartoon network have an app,6,question,does,en,US,success
cartoon network,does cartoon network own boomerang,7,question,does,en,US,success
cartoon network,does cartoon network still have games,9,question,does,en,US,success
cartoon network,does cartoon network require a subscription,10,question,does,en,US,success
cartoon network,how much cartoon network,1,question,how much,en,US,success
cartoon network,how much cartoon network worth,2,question,how much,en,US,success
cartoon network,how many cartoon network shows are there,3,question,how much,en,US,success
cartoon network,how many cartoon network hotels are there,4,question,how much,en,US,success
cartoon network,how many cartoon network,5,question,how much,en,US,success
cartoon network,how many cartoon network characters are there,6,question,how much,en,US,success
cartoon network,how many cartoon network movies are there,7,question,how much,en,US,success
cartoon network,how many cartoon network channels are there,8,question,how much,en,US,success
cartoon network,how many cartoon network shows are on max,9,question,how much,en,US,success
cartoon network,how many cartoon network are there,10,question,how much,en,US,success
cartoon network,will cartoon network die,4,question,should,en,US,success
cartoon network,will cartoon network still be a channel,5,question,should,en,US,success
cartoon network,will cartoon network,6,question,should,en,US,success
cartoon network,will cartoon network ever com back,8,question,should,en,US,success
cartoon network,will cartoon network end,10,question,should,en,US,success
cartoon network,how many cartoon network studios are there,9,question,how many,en,US,success
cartoon network,how many cartoon network shows are on hulu,10,question,how many,en,US,success
cartoon network,best place to watch cartoon network,1,question,best way to,en,US,success
cartoon network,cartoon network ideas,2,question,best way to,en,US,success
cartoon network,how to get cartoon network on tv,3,question,best way to,en,US,success
cartoon network,how to pitch a cartoon to cartoon network,4,question,best way to,en,US,success
cartoon network,cartoon network best place for cartoons,5,question,best way to,en,US,success