种子关键词,下拉词建议,排名,扩展类型,扩展词,语言,地区,状态
cartoon network,cartoon network,1,none,,en,US,success
cartoon network,cartoon network shows,2,none,,en,US,success
cartoon network,cartoon network closing,3,none,,en,US,success
cartoon network,cartoon network hotel,4,none,,en,US,success
cartoon network,cartoon network shows 2000s,5,none,,en,US,success
cartoon network,cartoon network tv shows,6,none,,en,US,success
cartoon network,cartoon network characters,7,none,,en,US,success
cartoon network,cartoon network games,8,none,,en,US,success
cartoon network,cartoon network ending,9,none,,en,US,success
cartoon network,cartoon network schedule,10,none,,en,US,success
cartoon network,top cartoon network shows,1,prefix,top,en,US,success
cartoon network,top cartoon network shows 2000s,2,prefix,top,en,US,success
cartoon network,top cartoon network shows of all time,3,prefix,top,en,US,success
cartoon network,top cartoon network,4,prefix,top,en,US,success
cartoon network,top cartoon network shows 90s,5,prefix,top,en,US,success
cartoon network,top cartoon network shows 2010s,6,prefix,top,en,US,success
cartoon network,top cartoon network characters,7,prefix,top,en,US,success
cartoon network,top cartoon network movies,8,prefix,top,en,US,success
cartoon network,cartoon network ranked,9,prefix,top,en,US,success
cartoon network,cartoon network shows ranked,10,prefix,top,en,US,success
cartoon network,what is cartoon network on,1,prefix,what is,en,US,success
cartoon network,what is cartoon network channel number,2,prefix,what is,en,US,success
cartoon network,what is cartoon network now,3,prefix,what is,en,US,success
cartoon network,what is cartoon network called now,4,prefix,what is,en,US,success
cartoon network,what is cartoon network owned by,5,prefix,what is,en,US,success
cartoon network,what is cartoon network's longest running show,6,prefix,what is,en,US,success
cartoon network,what is cartoon network's most popular show,7,prefix,what is,en,US,success
cartoon network,what is cartoon network's mascot,8,prefix,what is,en,US,success
cartoon network,what is cartoon network channel,9,prefix,what is,en,US,success
cartoon network,what is cartoon network currently airing,10,prefix,what is,en,US,success
cartoon network,how to cartoon network,1,prefix,how to,en,US,success
cartoon network,how to watch cartoon network,2,prefix,how to,en,US,success
cartoon network,how to watch cartoon network for free,3,prefix,how to,en,US,success
cartoon network,how to stream cartoon network,4,prefix,how to,en,US,success
cartoon network,how to watch cartoon network online,5,prefix,how to,en,US,success
cartoon network,how to watch cartoon network shows,6,prefix,how to,en,US,success
cartoon network,how to download cartoon network,7,prefix,how to,en,US,success
cartoon network,how to watch cartoon network shows for free,8,prefix,how to,en,US,success
cartoon network,how to download cartoon network app,9,prefix,how to,en,US,success
cartoon network,how to watch cartoon network old shows,10,prefix,how to,en,US,success
cartoon network,best cartoon network shows,1,prefix,best,en,US,success
cartoon network,best cartoon network christmas specials,2,prefix,best,en,US,success
cartoon network,best cartoon network shows of all time,3,prefix,best,en,US,success
cartoon network,best cartoon network shows 2000s,4,prefix,best,en,US,success
cartoon network,best cartoon network cartoons,5,prefix,best,en,US,success
cartoon network,best cartoon network halloween specials,6,prefix,best,en,US,success
cartoon network,best cartoon network games,7,prefix,best,en,US,success
cartoon network,best cartoon network characters,8,prefix,best,en,US,success
cartoon network,best cartoon network songs,9,prefix,best,en,US,success
cartoon network,best cartoon network halloween episodes,10,prefix,best,en,US,success
cartoon network,where's cartoon network,1,prefix,where,en,US,success
cartoon network,where cartoon network hotel,2,prefix,where,en,US,success
cartoon network,where is cartoon network studios,3,prefix,where,en,US,success
cartoon network,where is cartoon network streaming,4,prefix,where,en,US,success
cartoon network,where is cartoon network headquarters,5,prefix,where,en,US,success
cartoon network,where was cartoon network founded,6,prefix,where,en,US,success
cartoon network,where is cartoon network now,7,prefix,where,en,US,success
cartoon network,where was cartoon network made,8,prefix,where,en,US,success
cartoon network,where watch cartoon network,9,prefix,where,en,US,success
cartoon network,where are cartoon network shows,10,prefix,where,en,US,success
cartoon network,cartoon network cheap,1,prefix,cheap,en,US,success
cartoon network,cartoon network similar channels,2,prefix,cheap,en,US,success
cartoon network,cartoon network brands,3,prefix,cheap,en,US,success
cartoon network,free cartoon network,1,prefix,free,en,US,success
cartoon network,free cartoon network shows,2,prefix,free,en,US,success
cartoon network,free cartoon network games,3,prefix,free,en,US,success
cartoon network,free cartoon network coloring pages,4,prefix,free,en,US,success
cartoon network,free cartoon network live,5,prefix,free,en,US,success
cartoon network,free cartoon network games online,6,prefix,free,en,US,success
cartoon network,free cartoon network website,7,prefix,free,en,US,success
cartoon network,free cartoon network shows online,8,prefix,free,en,US,success
cartoon network,free cartoon network app,9,prefix,free,en,US,success
cartoon network,how can i watch cartoon network for free,10,prefix,free,en,US,success
cartoon network,when cartoon network started,1,prefix,when,en,US,success
cartoon network,when cartoon network shutdown,2,prefix,when,en,US,success
cartoon network,when cartoon network officially shutdown,3,prefix,when,en,US,success
cartoon network,when cartoon network end,4,prefix,when,en,US,success
cartoon network,when cartoon network was shut down,5,prefix,when,en,US,success
cartoon network,when cartoon network started in india,6,prefix,when,en,US,success
cartoon network,when cartoon network,7,prefix,when,en,US,success
cartoon network,when cartoon network was created,8,prefix,when,en,US,success
cartoon network,when cartoon network stopped,9,prefix,when,en,US,success
cartoon network,when did cartoon network shut down,10,prefix,when,en,US,success
cartoon network,why cartoon network shut down,1,prefix,why,en,US,success
cartoon network,why cartoon network failed,2,prefix,why,en,US,success
cartoon network,why cartoon network stopped old shows,3,prefix,why,en,US,success
cartoon network,why cartoon network is bad now,4,prefix,why,en,US,success
cartoon network,why cartoon network closed,5,prefix,why,en,US,success
cartoon network,why cartoon network officially shut down,6,prefix,why,en,US,success
cartoon network,why cartoon network website shut down,7,prefix,why,en,US,success
cartoon network,why cartoon network shut down in india,8,prefix,why,en,US,success
cartoon network,why cartoon network is banned,9,prefix,why,en,US,success
cartoon network,why cartoon network stopped,10,prefix,why,en,US,success
cartoon network,cartoon network online games,1,suffix,online,en,US,success
cartoon network,cartoon network online games 2000s,2,suffix,online,en,US,success
cartoon network,cartoon network online,3,suffix,online,en,US,success
cartoon network,cartoon network online game mmo,4,suffix,online,en,US,success
cartoon network,cartoon network online mmo,5,suffix,online,en,US,success
cartoon network,cartoon network online free,6,suffix,online,en,US,success
cartoon network,cartoon network online store,7,suffix,online,en,US,success
cartoon network,cartoon network online games free,8,suffix,online,en,US,success
cartoon network,cartoon network online watch,9,suffix,online,en,US,success
cartoon network,cartoon network online trading card game,10,suffix,online,en,US,success
cartoon network,cartoon network free,1,suffix,free,en,US,success
cartoon network,cartoon network free games,2,suffix,free,en,US,success
cartoon network,cartoon network free online,3,suffix,free,en,US,success
cartoon network,cartoon network free episodes,4,suffix,free,en,US,success
cartoon network,cartoon network free trial,5,suffix,free,en,US,success
cartoon network,cartoon network free shows,6,suffix,free,en,US,success
cartoon network,cartoon network free stream,7,suffix,free,en,US,success
cartoon network,cartoon network free online games,8,suffix,free,en,US,success
cartoon network,cartoon network free watch,9,suffix,free,en,US,success
cartoon network,cartoon network free roam game,10,suffix,free,en,US,success
cartoon network,cartoon network 2025,1,suffix,2025,en,US,success
cartoon network,cartoon network 2025 schedule,2,suffix,2025,en,US,success
cartoon network,cartoon network 2025 logo,3,suffix,2025,en,US,success
cartoon network,cartoon network 2025 bumpers,4,suffix,2025,en,US,success
cartoon network,cartoon network 2025 tv shows,5,suffix,2025,en,US,success
cartoon network,cartoon network 2025 crossover,6,suffix,2025,en,US,success
cartoon network,cartoon network 2025 promo,7,suffix,2025,en,US,success
cartoon network,cartoon network 2025 january,8,suffix,2025,en,US,success
cartoon network,cartoon network 2025 reddit,9,suffix,2025,en,US,success
cartoon network,cartoon network 2025 slate,10,suffix,2025,en,US,success
cartoon network,cartoon network guide,1,suffix,tutorial,en,US,success
cartoon network,cartoon network guide today,2,suffix,tutorial,en,US,success
cartoon network,cartoon network guide usa,3,suffix,tutorial,en,US,success
cartoon network,cartoon network guide australia,4,suffix,tutorial,en,US,success
cartoon network,cartoon network guide tv,5,suffix,tutorial,en,US,success
cartoon network,cartoon network guide uk,6,suffix,tutorial,en,US,success
cartoon network,cartoon network guide number,7,suffix,tutorial,en,US,success
cartoon network,cartoon network guide right now,8,suffix,tutorial,en,US,success
cartoon network,cartoon network drawing tutorial,9,suffix,tutorial,en,US,success
cartoon network,cartoon network art style tutorial,10,suffix,tutorial,en,US,success
cartoon network,online cartoon network games,1,prefix,online,en,US,success
cartoon network,online cartoon network,2,prefix,online,en,US,success
cartoon network,on cartoon network,3,prefix,online,en,US,success
cartoon network,on cartoon network now,4,prefix,online,en,US,success
cartoon network,on cartoon network today,5,prefix,online,en,US,success
cartoon network,kiss cartoon network,6,prefix,online,en,US,success
cartoon network,online watch cartoon network,7,prefix,online,en,US,success
cartoon network,free online cartoon network games,8,prefix,online,en,US,success
cartoon network,old online cartoon network games,9,prefix,online,en,US,success
cartoon network,free online cartoon network,10,prefix,online,en,US,success
cartoon network,cartoon network. tips,1,suffix,tips,en,US,success
cartoon network,cartoon network help,4,suffix,tips,en,US,success
cartoon network,cartoon network help cat,8,suffix,tips,en,US,success
cartoon network,cartoon network guidelines,8,suffix,guide,en,US,success
cartoon network,cartoon network near me,1,suffix,near me,en,US,success
cartoon network,cartoon network los angeles,2,suffix,near me,en,US,success
cartoon network,cartoon network hotel near me,3,suffix,near me,en,US,success
cartoon network,cartoon network store near me,4,suffix,near me,en,US,success
cartoon network,cartoon network studios near me,5,suffix,near me,en,US,success
cartoon network,cartoon network theme park near me,6,suffix,near me,en,US,success
cartoon network,cartoon network hours,7,suffix,near me,en,US,success
cartoon network,cartoon network headquarters,8,suffix,near me,en,US,success
cartoon network,cartoon network location,9,suffix,near me,en,US,success
cartoon network,cartoon network reddit,1,suffix,reddit,en,US,success
cartoon network,cartoon network shutdown reddit,2,suffix,reddit,en,US,success
cartoon network,cartoon network website reddit,3,suffix,reddit,en,US,success
cartoon network,cartoon network games reddit,4,suffix,reddit,en,US,success
cartoon network,cartoon network hotel reddit,5,suffix,reddit,en,US,success
cartoon network,cartoon network shows reddit,6,suffix,reddit,en,US,success
cartoon network,cartoon network schedule reddit,7,suffix,reddit,en,US,success
cartoon network,mad cartoon network reddit,8,suffix,reddit,en,US,success
cartoon network,cartoon network closing reddit,9,suffix,reddit,en,US,success
cartoon network,cartoon network live reddit,10,suffix,reddit,en,US,success
cartoon network,cartoon network battle crashers,1,alphabet,b,en,US,success
cartoon network,cartoon network burbank,2,alphabet,b,en,US,success
cartoon network,cartoon network building,3,alphabet,b,en,US,success
cartoon network,cartoon network best shows,4,alphabet,b,en,US,success
cartoon network,cartoon network bumpers,5,alphabet,b,en,US,success
cartoon network,cartoon network boomerang,6,alphabet,b,en,US,success
cartoon network,cartoon network box logo shirt,7,alphabet,b,en,US,success
cartoon network,cartoon network block party,8,alphabet,b,en,US,success
cartoon network,cartoon network bears,9,alphabet,b,en,US,success
cartoon network,cartoon network blue character,10,alphabet,b,en,US,success
cartoon network,cartoon network reviews,1,suffix,review,en,US,success
cartoon network,cartoon network hotel reviews,2,suffix,review,en,US,success
cartoon network,cartoon network world reviews,3,suffix,review,en,US,success
cartoon network,cartoon network racing review,4,suffix,review,en,US,success
cartoon network,cartoon network atlanta reviews,5,suffix,review,en,US,success
cartoon network,cartoon network hotel reviews lancaster pa,6,suffix,review,en,US,success
cartoon network,mad cartoon network review,7,suffix,review,en,US,success
cartoon network,cartoon network app review,8,suffix,review,en,US,success
cartoon network,cartoon network hotel reviews reddit,9,suffix,review,en,US,success
cartoon network,cartoon network dubai reviews,10,suffix,review,en,US,success
cartoon network,cartoon network app,1,alphabet,a,en,US,success
cartoon network,cartoon network adult swim,2,alphabet,a,en,US,success
cartoon network,cartoon network anime,3,alphabet,a,en,US,success
cartoon network,cartoon network activate,4,alphabet,a,en,US,success
cartoon network,cartoon network adventure time,5,alphabet,a,en,US,success
cartoon network,cartoon network animated shows,6,alphabet,a,en,US,success
cartoon network,cartoon network all shows,7,alphabet,a,en,US,success
cartoon network,cartoon network archive,8,alphabet,a,en,US,success
cartoon network,cartoon network and nickelodeon,9,alphabet,a,en,US,success
cartoon network,cartoon network alien invasion,10,alphabet,a,en,US,success
cartoon network,cartoon network dogs,1,alphabet,d,en,US,success
cartoon network,cartoon network dvds,2,alphabet,d,en,US,success
cartoon network,cartoon network directv,3,alphabet,d,en,US,success
cartoon network,cartoon network drawings,4,alphabet,d,en,US,success
cartoon network,cartoon network dead,5,alphabet,d,en,US,success
cartoon network,cartoon network dog show,6,alphabet,d,en,US,success
cartoon network,cartoon network dragon movie,7,alphabet,d,en,US,success
cartoon network,cartoon network discontinued,8,alphabet,d,en,US,success
cartoon network,cartoon network dog characters,9,alphabet,d,en,US,success
cartoon network,cartoon network dvd complete series,10,alphabet,d,en,US,success
cartoon network,cartoon network christmas specials,3,alphabet,c,en,US,success
cartoon network,cartoon network cartoons,4,alphabet,c,en,US,success
cartoon network,cartoon network careers,5,alphabet,c,en,US,success
cartoon network,cartoon network channel,6,alphabet,c,en,US,success
cartoon network,cartoon network channel number,7,alphabet,c,en,US,success
cartoon network,cartoon network cartoons 2000s,8,alphabet,c,en,US,success
cartoon network,cartoon network city,9,alphabet,c,en,US,success
cartoon network,cartoon network costumes,10,alphabet,c,en,US,success
cartoon network,cartoon network films produced,1,alphabet,f,en,US,success
cartoon network,cartoon network fusionfall,2,alphabet,f,en,US,success
cartoon network,cartoon network flash games,3,alphabet,f,en,US,success
cartoon network,cartoon network font,4,alphabet,f,en,US,success
cartoon network,cartoon network fighting game,5,alphabet,f,en,US,success
cartoon network,cartoon network female characters,6,alphabet,f,en,US,success
cartoon network,cartoon network flapjack,7,alphabet,f,en,US,success
cartoon network,cartoon network fridays,8,alphabet,f,en,US,success
cartoon network,cartoon network funko pop,9,alphabet,f,en,US,success
cartoon network,cartoon network fish show,10,alphabet,f,en,US,success
cartoon network,cartoon network girl characters,2,alphabet,g,en,US,success
cartoon network,cartoon network games online,3,alphabet,g,en,US,success
cartoon network,cartoon network games 2000s,4,alphabet,g,en,US,success
cartoon network,cartoon network grim reaper,5,alphabet,g,en,US,success
cartoon network,cartoon network game box,6,alphabet,g,en,US,success
cartoon network,cartoon network groovies,7,alphabet,g,en,US,success
cartoon network,cartoon network gumball,8,alphabet,g,en,US,success
cartoon network,cartoon network girls,10,alphabet,g,en,US,success
cartoon network,cartoon network eras,2,alphabet,e,en,US,success
cartoon network,cartoon network early 2000s,3,alphabet,e,en,US,success
cartoon network,cartoon network early 2000s shows,4,alphabet,e,en,US,success
cartoon network,cartoon network ed edd n eddy,5,alphabet,e,en,US,success
cartoon network,cartoon network end date,6,alphabet,e,en,US,success
cartoon network,cartoon network europe,7,alphabet,e,en,US,success
cartoon network,cartoon network episodes,8,alphabet,e,en,US,success
cartoon network,cartoon network evolution,9,alphabet,e,en,US,success
cartoon network,cartoon network east schedule,10,alphabet,e,en,US,success
cartoon network,cartoon network halloween movie,2,alphabet,h,en,US,success
cartoon network,cartoon network hotel closing,3,alphabet,h,en,US,success
cartoon network,cartoon network halloween specials,4,alphabet,h,en,US,success
cartoon network,cartoon network hotel prices,6,alphabet,h,en,US,success
cartoon network,cartoon network halloween,7,alphabet,h,en,US,success
cartoon network,cartoon network hotel lancaster pa,8,alphabet,h,en,US,success
cartoon network,cartoon network hotel location,9,alphabet,h,en,US,success
cartoon network,cartoon network halloween show,10,alphabet,h,en,US,success
cartoon network,cartoon network internships,1,alphabet,i,en,US,success
cartoon network,cartoon network imaginary friends,2,alphabet,i,en,US,success
cartoon network,cartoon network india,3,alphabet,i,en,US,success
cartoon network,cartoon network invaded,4,alphabet,i,en,US,success
cartoon network,cartoon network island show,5,alphabet,i,en,US,success
cartoon network,cartoon network intro,6,alphabet,i,en,US,success
cartoon network,cartoon network internet archive,7,alphabet,i,en,US,success
cartoon network,cartoon network italy,8,alphabet,i,en,US,success
cartoon network,cartoon network india shows,9,alphabet,i,en,US,success
cartoon network,cartoon network is gone,10,alphabet,i,en,US,success
cartoon network,cartoon network new shows,1,alphabet,n,en,US,success
cartoon network,cartoon network netflix,2,alphabet,n,en,US,success
cartoon network,cartoon network noods era,3,alphabet,n,en,US,success
cartoon network,cartoon network new shows 2025,4,alphabet,n,en,US,success
cartoon network,cartoon network nickelodeon,5,alphabet,n,en,US,success
cartoon network,cartoon network nascar,6,alphabet,n,en,US,success
cartoon network,cartoon network ninja show,7,alphabet,n,en,US,success
cartoon network,cartoon network net worth,8,alphabet,n,en,US,success
cartoon network,cartoon network news,9,alphabet,n,en,US,success
cartoon network,cartoon network new shows 2026,10,alphabet,n,en,US,success
cartoon network,cartoon network logo,1,alphabet,l,en,US,success
cartoon network,cartoon network live action shows,2,alphabet,l,en,US,success
cartoon network,cartoon network live,3,alphabet,l,en,US,success
cartoon network,cartoon network logopedia,4,alphabet,l,en,US,success
cartoon network,cartoon network logo history,5,alphabet,l,en,US,success
cartoon network,cartoon network latin america,6,alphabet,l,en,US,success
cartoon network,cartoon network late night shows,7,alphabet,l,en,US,success
cartoon network,cartoon network level up,8,alphabet,l,en,US,success
cartoon network,cartoon network lineup,9,alphabet,l,en,US,success
cartoon network,cartoon network logo 2004,10,alphabet,l,en,US,success
cartoon network,cartoon network jobs,1,alphabet,j,en,US,success
cartoon network,cartoon network johnny bravo,2,alphabet,j,en,US,success
cartoon network,cartoon network johnny test,3,alphabet,j,en,US,success
cartoon network,cartoon network japan,4,alphabet,j,en,US,success
cartoon network,cartoon network jingle,5,alphabet,j,en,US,success
cartoon network,cartoon network jonny quest,6,alphabet,j,en,US,success
cartoon network,cartoon network juniper lee,7,alphabet,j,en,US,success
cartoon network,cartoon network johnny,8,alphabet,j,en,US,success
cartoon network,cartoon network justice league,9,alphabet,j,en,US,success
cartoon network,cartoon network jacket,10,alphabet,j,en,US,success
cartoon network,cartoon network movies,1,alphabet,m,en,US,success
cartoon network,cartoon network mmo,2,alphabet,m,en,US,success
cartoon network,cartoon network mad,3,alphabet,m,en,US,success
cartoon network,cartoon network merch,4,alphabet,m,en,US,success
cartoon network,cartoon network monster show,5,alphabet,m,en,US,success
cartoon network,cartoon network movies 2000s,6,alphabet,m,en,US,success
cartoon network,cartoon network mmorpg,7,alphabet,m,en,US,success
cartoon network,cartoon network moms,8,alphabet,m,en,US,success
cartoon network,cartoon network mascot,9,alphabet,m,en,US,success
cartoon network,cartoon network mmo game,10,alphabet,m,en,US,success
cartoon network,cartoon network kids next door,1,alphabet,k,en,US,success
cartoon network,cartoon network kids shows,2,alphabet,k,en,US,success
cartoon network,cartoon network kids,3,alphabet,k,en,US,success
cartoon network,cartoon network korea,4,alphabet,k,en,US,success
cartoon network,cartoon network kids shows 2000s,5,alphabet,k,en,US,success
cartoon network,cartoon network karate show,6,alphabet,k,en,US,success
cartoon network,cartoon network kids in treehouse,7,alphabet,k,en,US,success
cartoon network,cartoon network kart racing,8,alphabet,k,en,US,success
cartoon network,cartoon network king of the hill,9,alphabet,k,en,US,success
cartoon network,cartoon network keychain,10,alphabet,k,en,US,success
cartoon network,cartoon network quotes,1,alphabet,q,en,US,success
cartoon network,cartoon network quiz,2,alphabet,q,en,US,success
cartoon network,cartoon network questions,3,alphabet,q,en,US,success
cartoon network,cartoon network questions and answers,4,alphabet,q,en,US,success
cartoon network,cartoon network quiz with answers,5,alphabet,q,en,US,success
cartoon network,cartoon network qualitipedia,6,alphabet,q,en,US,success
cartoon network,cartoon network quiz show,7,alphabet,q,en,US,success
cartoon network,cartoon network q,8,alphabet,q,en,US,success
cartoon network,cartoon network quest,9,alphabet,q,en,US,success
cartoon network,cartoon network qatar,10,alphabet,q,en,US,success
cartoon network,cartoon network old shows,1,alphabet,o,en,US,success
cartoon network,cartoon network old games,2,alphabet,o,en,US,success
cartoon network,cartoon network old cartoons,3,alphabet,o,en,US,success
cartoon network,cartoon network over the garden wall,5,alphabet,o,en,US,success
cartoon network,cartoon network on directv,6,alphabet,o,en,US,success
cartoon network,cartoon network original shows,7,alphabet,o,en,US,success
cartoon network,cartoon network owner,8,alphabet,o,en,US,success
cartoon network,cartoon network old logo,9,alphabet,o,en,US,success
cartoon network,cartoon network original movies,10,alphabet,o,en,US,success
cartoon network,cartoon network punch time explosion,1,alphabet,p,en,US,success
cartoon network,cartoon network programming,2,alphabet,p,en,US,success
cartoon network,cartoon network punch time explosion xl,3,alphabet,p,en,US,success
cartoon network,cartoon network purple character,4,alphabet,p,en,US,success
cartoon network,cartoon network pirate show,5,alphabet,p,en,US,success
cartoon network,cartoon network powerpuff girls,6,alphabet,p,en,US,success
cartoon network,cartoon network poster,7,alphabet,p,en,US,success
cartoon network,cartoon network parent company,8,alphabet,p,en,US,success
cartoon network,cartoon network promo,9,alphabet,p,en,US,success
cartoon network,cartoon network popular shows,10,alphabet,p,en,US,success
cartoon network,cartoon network racing,1,alphabet,r,en,US,success
cartoon network,cartoon network robot show,2,alphabet,r,en,US,success
cartoon network,cartoon network regular show,3,alphabet,r,en,US,success
cartoon network,cartoon network resort game,4,alphabet,r,en,US,success
cartoon network,cartoon network resort,5,alphabet,r,en,US,success
cartoon network,cartoon network robot,6,alphabet,r,en,US,success
cartoon network,cartoon network racing game,7,alphabet,r,en,US,success
cartoon network,cartoon network robot fighting game,8,alphabet,r,en,US,success
cartoon network,cartoon network racing show,9,alphabet,r,en,US,success
cartoon network,cartoon network racing ps2,10,alphabet,r,en,US,success
cartoon network,cartoon network shutdown,4,alphabet,s,en,US,success
cartoon network,cartoon network studios,5,alphabet,s,en,US,success
cartoon network,cartoon network shows 2010s,6,alphabet,s,en,US,success
cartoon network,cartoon network streaming,7,alphabet,s,en,US,success
cartoon network,cartoon network shows old,8,alphabet,s,en,US,success
cartoon network,cartoon network shows 90s,9,alphabet,s,en,US,success
cartoon network,cartoon network shows list,10,alphabet,s,en,US,success
cartoon network,cartoon network uk,1,alphabet,u,en,US,success
cartoon network,cartoon network uncle grandpa,2,alphabet,u,en,US,success
cartoon network,cartoon network universe fusionfall,3,alphabet,u,en,US,success
