种子关键词,下拉词建议,排名,扩展类型,扩展词,语言,地区,状态
beginners pdf,what is forex trading for beginners pdf,1,prefix,what is,en,US,success
beginners pdf,what is a simple pdf,2,prefix,what is,en,US,success
beginners pdf,basic english words for beginners pdf,3,prefix,what is,en,US,success
beginners pdf,how to draw beginners pdf,1,prefix,how to,en,US,success
beginners pdf,how to crochet beginners pdf,2,prefix,how to,en,US,success
beginners pdf,how to knit for beginners pdf,3,prefix,how to,en,US,success
beginners pdf,how to play chess beginners pdf,4,prefix,how to,en,US,success
beginners pdf,how to play keyboard for beginners pdf,5,prefix,how to,en,US,success
beginners pdf,how to play drums for beginners pdf,6,prefix,how to,en,US,success
beginners pdf,how to trade forex for beginners pdf,7,prefix,how to,en,US,success
beginners pdf,how to play piano for beginners pdf,8,prefix,how to,en,US,success
beginners pdf,how to cross stitch for beginners pdf,9,prefix,how to,en,US,success
beginners pdf,how to use excel for beginners pdf,10,prefix,how to,en,US,success
beginners pdf,best thai for beginners pdf free download,1,prefix,best,en,US,success
beginners pdf,best novels for beginners pdf,2,prefix,best,en,US,success
beginners pdf,best cryptocurrency for beginners pdf,3,prefix,best,en,US,success
beginners pdf,best chess for beginners pdf download free,4,prefix,best,en,US,success
beginners pdf,best book for beginners pdf,5,prefix,best,en,US,success
beginners pdf,best drawing for beginners pdf,6,prefix,best,en,US,success
beginners pdf,best chess for beginners pdf,7,prefix,best,en,US,success
beginners pdf,best psychology for beginners pdf,8,prefix,best,en,US,success
beginners pdf,best astronomy for beginners pdf,9,prefix,best,en,US,success
beginners pdf,best aquascaping for beginners pdf,10,prefix,best,en,US,success
beginners pdf,beginner pdf english,1,none,,en,US,success
beginners pdf,beginner pdf english file,2,none,,en,US,success
beginners pdf,python beginners pdf,3,none,,en,US,success
beginners pdf,arabic beginners pdf,4,none,,en,US,success
beginners pdf,reading beginners pdf,5,none,,en,US,success
beginners pdf,piano beginners pdf,6,none,,en,US,success
beginners pdf,forex beginners pdf,7,none,,en,US,success
beginners pdf,forex beginners pdf download,8,none,,en,US,success
beginners pdf,java beginners pdf,9,none,,en,US,success
beginners pdf,french beginners pdf,10,none,,en,US,success
beginners pdf,free dummies pdf,1,prefix,free,en,US,success
beginners pdf,free english for beginners pdf,2,prefix,free,en,US,success
beginners pdf,free arabic for beginners pdf,3,prefix,free,en,US,success
beginners pdf,free excel for beginners pdf,4,prefix,free,en,US,success
beginners pdf,free coding for beginners pdf,5,prefix,free,en,US,success
beginners pdf,free ai for beginners pdf,6,prefix,free,en,US,success
beginners pdf,free spanish for beginners pdf,7,prefix,free,en,US,success
beginners pdf,free crochet for beginners pdf,8,prefix,free,en,US,success
beginners pdf,amigurumi patterns free beginners pdf,9,prefix,free,en,US,success
beginners pdf,free python for beginners pdf,10,prefix,free,en,US,success
beginners pdf,tally beginners tutorial pdf,1,suffix,tutorial,en,US,success
beginners pdf,ubuntu beginners tutorial pdf,2,suffix,tutorial,en,US,success
beginners pdf,ansible beginners tutorial pdf,3,suffix,tutorial,en,US,success
beginners pdf,java beginners tutorial pdf,4,suffix,tutorial,en,US,success
beginners pdf,beginners excel tutorial pdf,5,suffix,tutorial,en,US,success
beginners pdf,spss beginners tutorial pdf,6,suffix,tutorial,en,US,success
beginners pdf,python beginners tutorial pdf,7,suffix,tutorial,en,US,success
beginners pdf,autocad beginners tutorial pdf,8,suffix,tutorial,en,US,success
beginners pdf,powerpoint for beginners tutorial pdf,9,suffix,tutorial,en,US,success
beginners pdf,ms word beginners tutorial pdf,10,suffix,tutorial,en,US,success
beginners pdf,dummies pdf free download,1,suffix,free,en,US,success
beginners pdf,dummies pdf free,2,suffix,free,en,US,success
beginners pdf,python beginners pdf free download,3,suffix,free,en,US,success
beginners pdf,yoga beginners pdf free download,4,suffix,free,en,US,success
beginners pdf,headway beginner pdf free download,5,suffix,free,en,US,success
beginners pdf,forex beginner pdf free download,6,suffix,free,en,US,success
beginners pdf,navigate beginner pdf free download,7,suffix,free,en,US,success
beginners pdf,hskk beginner pdf free download,8,suffix,free,en,US,success
beginners pdf,headway beginner pdf free,9,suffix,free,en,US,success
beginners pdf,english for beginners pdf free download,10,suffix,free,en,US,success
beginners pdf,online trading for beginners pdf,1,prefix,online,en,US,success
beginners pdf,online forex trading for beginners pdf,2,prefix,online,en,US,success
beginners pdf,online trading guide for beginners pdf,3,prefix,online,en,US,success
beginners pdf,online trading course for beginners pdf,4,prefix,online,en,US,success
beginners pdf,quickbooks online for beginners pdf,5,prefix,online,en,US,success
beginners pdf,online trading tips for beginners pdf,6,prefix,online,en,US,success
beginners pdf,how to start learning online,7,prefix,online,en,US,success
beginners pdf,python for beginners pdf 2025,1,suffix,2025,en,US,success
beginners pdf,wordpress for beginners 2025 pdf,2,suffix,2025,en,US,success
beginners pdf,forex trading for beginners pdf 2025,3,suffix,2025,en,US,success
beginners pdf,2021 to 2025 how many years,4,suffix,2025,en,US,success
beginners pdf,2021 to 2025 literature syllabus,5,suffix,2025,en,US,success
beginners pdf,how to cook for beginners pdf,6,suffix,2025,en,US,success
beginners pdf,how to make pdf easily,7,suffix,2025,en,US,success
beginners pdf,beginner guide pdf,1,suffix,guide,en,US,success
beginners pdf,pdf beginner's guide to reading schematics,2,suffix,guide,en,US,success
beginners pdf,dummies guide pdf,3,suffix,guide,en,US,success
beginners pdf,dnd beginners guide pdf,4,suffix,guide,en,US,success
beginners pdf,forex beginners guide pdf,5,suffix,guide,en,US,success
beginners pdf,trading beginners guide pdf,6,suffix,guide,en,US,success
beginners pdf,f1 beginners guide pdf,7,suffix,guide,en,US,success
beginners pdf,autocad beginners guide pdf,8,suffix,guide,en,US,success
beginners pdf,python beginners guide pdf,9,suffix,guide,en,US,success
beginners pdf,chess beginners guide pdf,10,suffix,guide,en,US,success
beginners pdf,pop culture for beginners pdf reddit,1,suffix,reddit,en,US,success
beginners pdf,spanish books for beginners pdf reddit,2,suffix,reddit,en,US,success
beginners pdf,fitnessfaqs calisthenics for beginners pdf reddit,3,suffix,reddit,en,US,success
beginners pdf,starter books for adults,4,suffix,reddit,en,US,success
beginners pdf,beginners calculus pdf,1,alphabet,c,en,US,success
beginners pdf,beginners crochet pdf,2,alphabet,c,en,US,success
beginners pdf,beginners chemistry pdf,3,alphabet,c,en,US,success
beginners pdf,beginners chess pdf,4,alphabet,c,en,US,success
beginners pdf,beginner calisthenics pdf,5,alphabet,c,en,US,success
beginners pdf,beginner chinese pdf,6,alphabet,c,en,US,success
beginners pdf,beginner c++ pdf,7,alphabet,c,en,US,success
beginners pdf,dummies calculus pdf,8,alphabet,c,en,US,success
beginners pdf,arabic for beginners pdf calicut university,9,alphabet,c,en,US,success
beginners pdf,beginners guitar chords pdf,10,alphabet,c,en,US,success
beginners pdf,dummies pdf books,1,alphabet,b,en,US,success
beginners pdf,beginner's bible pdf,2,alphabet,b,en,US,success
beginners pdf,beginner book pdf english,3,alphabet,b,en,US,success
beginners pdf,html beginners pdf book,4,alphabet,b,en,US,success
beginners pdf,beginner piano pdf book,5,alphabet,b,en,US,success
beginners pdf,french beginners book pdf,6,alphabet,b,en,US,success
beginners pdf,urdu beginners book pdf,7,alphabet,b,en,US,success
beginners pdf,python beginners book pdf,8,alphabet,b,en,US,success
beginners pdf,trading beginners books pdf,9,alphabet,b,en,US,success
beginners pdf,beginners grammar book pdf,10,alphabet,b,en,US,success
beginners pdf,beginners algebra pdf,1,alphabet,a,en,US,success
beginners pdf,beginners arabic pdf,2,alphabet,a,en,US,success
beginners pdf,dummies accounting pdf,3,alphabet,a,en,US,success
beginners pdf,autocad beginners pdf,4,alphabet,a,en,US,success
beginners pdf,arduino beginners pdf,5,alphabet,a,en,US,success
beginners pdf,astronomy beginners pdf,6,alphabet,a,en,US,success
beginners pdf,accounting beginners pdf,7,alphabet,a,en,US,success
beginners pdf,astrology beginners pdf,8,alphabet,a,en,US,success
beginners pdf,ai beginners pdf,9,alphabet,a,en,US,success
beginners pdf,easy book for beginners,10,alphabet,a,en,US,success
beginners pdf,beginners danish pdf,1,alphabet,d,en,US,success
beginners pdf,beginners drawing pdf,2,alphabet,d,en,US,success
beginners pdf,beginners dutch pdf,3,alphabet,d,en,US,success
beginners pdf,coding for beginners pdf free download,9,alphabet,d,en,US,success
beginners pdf,chess for beginners pdf download free,10,alphabet,d,en,US,success
beginners pdf,beginners french pdf,1,alphabet,f,en,US,success
beginners pdf,beginners forex pdf,2,alphabet,f,en,US,success
beginners pdf,beginner french pdf textbook,3,alphabet,f,en,US,success
beginners pdf,dummies french pdf,6,alphabet,f,en,US,success
beginners pdf,beginners hindi pdf,1,alphabet,h,en,US,success
beginners pdf,beginner html pdf,2,alphabet,h,en,US,success
beginners pdf,dummies html pdf,3,alphabet,h,en,US,success
beginners pdf,dnd beginners handbook pdf,4,alphabet,h,en,US,success
beginners pdf,minecraft beginners handbook pdf,5,alphabet,h,en,US,success
beginners pdf,algebra for beginners pdf hall and knight,6,alphabet,h,en,US,success
beginners pdf,trading for beginners pdf hindi,7,alphabet,h,en,US,success
beginners pdf,beginners guide to homeopathy pdf,8,alphabet,h,en,US,success
beginners pdf,headway beginners pdf,9,alphabet,h,en,US,success
beginners pdf,sap fico beginners handbook pdf,10,alphabet,h,en,US,success
beginners pdf,beginners german pdf,1,alphabet,g,en,US,success
beginners pdf,beginners guitar pdf,2,alphabet,g,en,US,success
beginners pdf,beginners grammar pdf,3,alphabet,g,en,US,success
beginners pdf,beginners greek pdf,4,alphabet,g,en,US,success
beginners pdf,beginner's georgian pdf,5,alphabet,g,en,US,success
beginners pdf,beginner guitar pdf book,6,alphabet,g,en,US,success
beginners pdf,dummies ged pdf,8,alphabet,g,en,US,success
beginners pdf,pdf beginners what is forex trading,3,alphabet,e,en,US,success
beginners pdf,dummies pdf,4,alphabet,e,en,US,success
beginners pdf,pdf beginner english book,6,alphabet,e,en,US,success
beginners pdf,pdf beginner piano,7,alphabet,e,en,US,success
beginners pdf,beginners italian pdf,1,alphabet,i,en,US,success
beginners pdf,learning zulu for beginners pdf in zulu,3,alphabet,i,en,US,success
beginners pdf,ielts beginners pdf,4,alphabet,i,en,US,success
beginners pdf,python for beginners in pdf,5,alphabet,i,en,US,success
beginners pdf,english for beginners in pdf,6,alphabet,i,en,US,success
beginners pdf,tamil learning for beginners pdf in tamil,7,alphabet,i,en,US,success
beginners pdf,how to make a sentence in english for beginners pdf,9,alphabet,i,en,US,success
beginners pdf,chemistry for beginners pdf notes,1,alphabet,n,en,US,success
beginners pdf,java beginners notes pdf,2,alphabet,n,en,US,success
beginners pdf,calculus for beginners pdf notes,3,alphabet,n,en,US,success
beginners pdf,python for beginners pdf notes,4,alphabet,n,en,US,success
beginners pdf,accounting for beginners pdf notes,5,alphabet,n,en,US,success
beginners pdf,computer for beginners pdf notes,6,alphabet,n,en,US,success
beginners pdf,coding for beginners pdf notes,7,alphabet,n,en,US,success
beginners pdf,music theory for beginners pdf notes,8,alphabet,n,en,US,success
beginners pdf,kanji for beginners n4 pdf,9,alphabet,n,en,US,success
beginners pdf,computer basics for beginners pdf notes,10,alphabet,n,en,US,success
beginners pdf,beginners korean pdf,1,alphabet,k,en,US,success
beginners pdf,keyboard beginners pdf,2,alphabet,k,en,US,success
beginners pdf,beginner kanji pdf,3,alphabet,k,en,US,success
beginners pdf,pdf beginner kindergarten alphabet worksheets,4,alphabet,k,en,US,success
beginners pdf,guidely beginners kit pdf,5,alphabet,k,en,US,success
beginners pdf,english for beginners pdf kids,6,alphabet,k,en,US,success
beginners pdf,karnatik beginners pdf,7,alphabet,k,en,US,success
beginners pdf,piano for beginners kids pdf,8,alphabet,k,en,US,success
beginners pdf,beginners russian anna kudyma pdf,9,alphabet,k,en,US,success
beginners pdf,spanish for beginners kids pdf,10,alphabet,k,en,US,success
beginners pdf,the beginner's mind pdf,1,alphabet,m,en,US,success
beginners pdf,beginners mathematics pdf,2,alphabet,m,en,US,success
beginners pdf,beginner mandarin pdf,3,alphabet,m,en,US,success
beginners pdf,ncfm beginners module pdf download,4,alphabet,m,en,US,success
beginners pdf,3x3 beginners method pdf,5,alphabet,m,en,US,success
beginners pdf,rubiks beginners method pdf,6,alphabet,m,en,US,success
beginners pdf,beginners stock market pdf,7,alphabet,m,en,US,success
beginners pdf,beginners reading materials pdf free download,8,alphabet,m,en,US,success
beginners pdf,zen beginners mind pdf,9,alphabet,m,en,US,success
beginners pdf,beginners piano music pdf,10,alphabet,m,en,US,success
beginners pdf,beginner level pdf,1,alphabet,l,en,US,success
beginners pdf,beginners piano lessons pdf,2,alphabet,l,en,US,success
beginners pdf,beginners english lessons pdf,3,alphabet,l,en,US,success
beginners pdf,beginners keyboard lessons pdf,4,alphabet,l,en,US,success
beginners pdf,beginners guitar lessons pdf,5,alphabet,l,en,US,success
beginners pdf,beginners bible study lessons pdf,6,alphabet,l,en,US,success
beginners pdf,linux beginners pdf,7,alphabet,l,en,US,success
beginners pdf,easy english books to read for beginners pdf,9,alphabet,l,en,US,success
beginners pdf,beginners japanese pdf,1,alphabet,j,en,US,success
beginners pdf,beginner javascript pdf,2,alphabet,j,en,US,success
beginners pdf,beginner java pdf,3,alphabet,j,en,US,success
beginners pdf,beginner jazz pdf,4,alphabet,j,en,US,success
beginners pdf,dummies javascript pdf,5,alphabet,j,en,US,success
beginners pdf,linux for beginners pdf jason cannon,6,alphabet,j,en,US,success
beginners pdf,tagalog for beginners pdf joi barrios,7,alphabet,j,en,US,success
beginners pdf,beginners guide to javascript pdf,8,alphabet,j,en,US,success
beginners pdf,java beginners pdf free download,9,alphabet,j,en,US,success
beginners pdf,teach yourself beginners japanese pdf,10,alphabet,j,en,US,success
beginners pdf,beginners spanish pdf,1,alphabet,s,en,US,success
beginners pdf,beginners swedish pdf,2,alphabet,s,en,US,success
beginners pdf,beginner sql pdf,3,alphabet,s,en,US,success
beginners pdf,usborne beginners science pdf,4,alphabet,s,en,US,success
beginners pdf,beginners yoga sequence pdf,5,alphabet,s,en,US,success
beginners pdf,beginners chess strategy pdf,6,alphabet,s,en,US,success
beginners pdf,beginners piano songs pdf,7,alphabet,s,en,US,success
beginners pdf,beginners ukulele songs pdf,8,alphabet,s,en,US,success
beginners pdf,beginners guitar songs pdf,9,alphabet,s,en,US,success
beginners pdf,beginners bible study pdf,10,alphabet,s,en,US,success
beginners pdf,beginners piano pdf,1,alphabet,p,en,US,success
beginners pdf,beginners python pdf,2,alphabet,p,en,US,success
beginners pdf,beginners polish pdf,3,alphabet,p,en,US,success
beginners pdf,beginners photography pdf,4,alphabet,p,en,US,success
beginners pdf,beginners physics pdf,5,alphabet,p,en,US,success
beginners pdf,dummies python pdf,7,alphabet,p,en,US,success
beginners pdf,dummies piano pdf,8,alphabet,p,en,US,success
beginners pdf,beginners running plan pdf,9,alphabet,p,en,US,success
beginners pdf,beginners piano pieces pdf,10,alphabet,p,en,US,success
beginners pdf,beginners origami pdf,1,alphabet,o,en,US,success
beginners pdf,beginner oll pdf,2,alphabet,o,en,US,success
beginners pdf,english books for beginners pdf oxford,3,alphabet,o,en,US,success
beginners pdf,english for beginners oxford pdf,4,alphabet,o,en,US,success
beginners pdf,beginner quran pdf,1,alphabet,q,en,US,success
beginners pdf,how to knit a flower for beginners step by step,2,alphabet,q,en,US,success
beginners pdf,how to knit easy for beginners,3,alphabet,q,en,US,success
beginners pdf,beginners russian pdf,1,alphabet,r,en,US,success
beginners pdf,beginners reading pdf,2,alphabet,r,en,US,success
beginners pdf,beginner readers pdf,3,alphabet,r,en,US,success
beginners pdf,beginners arabic reading pdf,4,alphabet,r,en,US,success
beginners pdf,react beginners pdf,5,alphabet,r,en,US,success
beginners pdf,english for beginners reading pdf,6,alphabet,r,en,US,success
beginners pdf,text for beginners reading pdf,7,alphabet,r,en,US,success
beginners pdf,revit beginners pdf,8,alphabet,r,en,US,success
beginners pdf,beginners trading pdf,1,alphabet,t,en,US,success
beginners pdf,beginners spanish textbook pdf,3,alphabet,t,en,US,success
beginners pdf,beginners japanese textbook pdf,4,alphabet,t,en,US,success
beginners pdf,beginners korean textbook pdf,5,alphabet,t,en,US,success
beginners pdf,beginners german textbook pdf,6,alphabet,t,en,US,success
beginners pdf,beginners russian textbook pdf,7,alphabet,t,en,US,success
beginners pdf,beginners italian textbook pdf,8,alphabet,t,en,US,success
beginners pdf,beginners forex trading pdf,9,alphabet,t,en,US,success
beginners pdf,beginners chinese textbook pdf,10,alphabet,t,en,US,success
beginners pdf,beginners ukrainian pdf,1,alphabet,u,en,US,success
beginners pdf,beginners urdu pdf,2,alphabet,u,en,US,success
beginners pdf,beginner ukulele pdf,3,alphabet,u,en,US,success
beginners pdf,economics for beginners usborne pdf,4,alphabet,u,en,US,success
beginners pdf,money for beginners usborne pdf,5,alphabet,u,en,US,success
beginners pdf,politics for beginners usborne pdf,6,alphabet,u,en,US,success
beginners pdf,usborne beginners pdf,7,alphabet,u,en,US,success
beginners pdf,physics for beginners usborne pdf,8,alphabet,u,en,US,success
beginners pdf,psychology for beginners usborne pdf,9,alphabet,u,en,US,success
beginners pdf,philosophy for beginners usborne pdf,10,alphabet,u,en,US,success
beginners pdf,beginners worksheets pdf,2,alphabet,w,en,US,success
beginners pdf,beginner workout pdf,3,alphabet,w,en,US,success
beginners pdf,beginner watchmaking pdf,4,alphabet,w,en,US,success
beginners pdf,headway beginner pdf workbook,5,alphabet,w,en,US,success
beginners pdf,sketching for beginners pdf with pencil,6,alphabet,w,en,US,success
beginners pdf,yoga for beginners pdf with pictures,7,alphabet,w,en,US,success
beginners pdf,italian beginners workbook pdf,8,alphabet,w,en,US,success
beginners pdf,english for beginners pdf worksheets,9,alphabet,w,en,US,success
beginners pdf,listening for beginners pdf with answers,10,alphabet,w,en,US,success
beginners pdf,beginners guide to xero pdf,1,alphabet,x,en,US,success
beginners pdf,how to crochet easy beginners,3,alphabet,x,en,US,success
beginners pdf,beginners vocabulary pdf,1,alphabet,v,en,US,success
beginners pdf,beginners violin pdf,2,alphabet,v,en,US,success
beginners pdf,beginner vietnamese pdf,3,alphabet,v,en,US,success
beginners pdf,beginner viola pdf,4,alphabet,v,en,US,success
beginners pdf,headway beginner pdf vk,5,alphabet,v,en,US,success
beginners pdf,speakout beginner pdf vk,6,alphabet,v,en,US,success
beginners pdf,life beginner pdf vk,7,alphabet,v,en,US,success
beginners pdf,beginners tom vanderbilt pdf,8,alphabet,v,en,US,success
beginners pdf,russian for beginners pdf vk,9,alphabet,v,en,US,success
beginners pdf,spanish for beginners pdf vk,10,alphabet,v,en,US,success
beginners pdf,beginners yoga pdf,1,alphabet,y,en,US,success
beginners pdf,beginner's yoruba pdf,2,alphabet,y,en,US,success
beginners pdf,pdf beginner yoga poses chart,3,alphabet,y,en,US,success
beginners pdf,beginner pdf printable yoga poses chart,4,alphabet,y,en,US,success
beginners pdf,beginners guide to yoga pdf,5,alphabet,y,en,US,success
beginners pdf,beginners german teach yourself pdf,7,alphabet,y,en,US,success
beginners pdf,beginners or beginner,9,alphabet,y,en,US,success
beginners pdf,beginners guide to zbrush pdf,1,alphabet,z,en,US,success
beginners pdf,beginners guide to zbrush pdf free download,2,alphabet,z,en,US,success
beginners pdf,smallest pdf file,4,alphabet,z,en,US,success
beginners pdf,how to start reading books for beginners,6,alphabet,z,en,US,success
beginners pdf,can exercises beginners pdf,1,question,can,en,US,success
beginners pdf,can test for beginners pdf,2,question,can,en,US,success
beginners pdf,can could exercises for beginners pdf,3,question,can,en,US,success
beginners pdf,can pdf exercises,4,question,can,en,US,success
beginners pdf,can everyone open a pdf,6,question,can,en,US,success
beginners pdf,do does exercises for beginners pdf,1,question,does,en,US,success
beginners pdf,how to learn it for beginners,2,question,does,en,US,success
beginners pdf,how to knit books for beginners,3,question,does,en,US,success
beginners pdf,how much how many exercises for beginners pdf,1,question,how much,en,US,success
beginners pdf,learn how to knit for beginners step by step,2,question,how much,en,US,success
beginners pdf,how many pairs are there in 12,2,question,how many,en,US,success
beginners pdf,how to knit for beginners step-by-step with pictures,3,question,how many,en,US,success