种子关键词,下拉词建议,排名,扩展类型,扩展词,语言,地区,状态
speech therapy,speech therapy,1,none,,en,US,success
speech therapy,speech therapy washington,2,none,,en,US,success
speech therapy,speech therapy alexandria va,3,none,,en,US,success
speech therapy,speech therapy near me,4,none,,en,US,success
speech therapy,speech therapy fredericksburg va,5,none,,en,US,success
speech therapy,speech therapy for toddlers,6,none,,en,US,success
speech therapy,speech therapy for adults,7,none,,en,US,success
speech therapy,speech therapy for kids,8,none,,en,US,success
speech therapy,speech therapy frederick md,9,none,,en,US,success
speech therapy,speech therapy waldorf md,10,none,,en,US,success
speech therapy,best speech therapy apps,1,prefix,best,en,US,success
speech therapy,best speech therapy near me,2,prefix,best,en,US,success
speech therapy,best speech therapy toys,3,prefix,best,en,US,success
speech therapy,best speech therapy apps for kids,4,prefix,best,en,US,success
speech therapy,best speech therapy games,5,prefix,best,en,US,success
speech therapy,best speech therapy apps for toddlers,6,prefix,best,en,US,success
speech therapy,best speech therapy videos for toddlers,7,prefix,best,en,US,success
speech therapy,best speech therapy for kids near me,8,prefix,best,en,US,success
speech therapy,best speech therapy for adults,9,prefix,best,en,US,success
speech therapy,best speech therapy books,10,prefix,best,en,US,success
speech therapy,how to speech therapy at home,1,prefix,how to,en,US,success
speech therapy,how to speech therapy,2,prefix,how to,en,US,success
speech therapy,how to speech therapy for toddler,3,prefix,how to,en,US,success
speech therapy,how to speech therapy for kids,4,prefix,how to,en,US,success
speech therapy,how to therapy speech delay,5,prefix,how to,en,US,success
speech therapy,how to speak therapy,6,prefix,how to,en,US,success
speech therapy,how to voice therapy,7,prefix,how to,en,US,success
speech therapy,how to speech therapist,8,prefix,how to,en,US,success
speech therapy,how to give speech therapy at home,9,prefix,how to,en,US,success
speech therapy,how to study speech therapy,10,prefix,how to,en,US,success
speech therapy,top speech therapy programs,1,prefix,top,en,US,success
speech therapy,top speech therapy toys,2,prefix,top,en,US,success
speech therapy,top speech therapy materials,3,prefix,top,en,US,success
speech therapy,top speech therapy near me,4,prefix,top,en,US,success
speech therapy,top speech therapy games,5,prefix,top,en,US,success
speech therapy,top speech therapy apps,6,prefix,top,en,US,success
speech therapy,top speech therapy,7,prefix,top,en,US,success
speech therapy,top speech therapy in bareilly,8,prefix,top,en,US,success
speech therapy,top speech therapy schools,9,prefix,top,en,US,success
speech therapy,top speech therapy colleges in tamilnadu,10,prefix,top,en,US,success
speech therapy,what is speech therapy,1,prefix,what is,en,US,success
speech therapy,what is speech therapy for kids,2,prefix,what is,en,US,success
speech therapy,what is speech therapy for adults,3,prefix,what is,en,US,success
speech therapy,what is speech therapy for toddlers,4,prefix,what is,en,US,success
speech therapy,what is speech therapy called,5,prefix,what is,en,US,success
speech therapy,what is speech therapy used for,6,prefix,what is,en,US,success
speech therapy,what is speech therapy in school,7,prefix,what is,en,US,success
speech therapy,what is speech therapy for autism,8,prefix,what is,en,US,success
speech therapy,what is speech therapy good for,9,prefix,what is,en,US,success
speech therapy,what is speech therapy like,10,prefix,what is,en,US,success
speech therapy,why speech therapy,1,prefix,why,en,US,success
speech therapy,why speech therapy is important,2,prefix,why,en,US,success
speech therapy,why speech therapy questions,3,prefix,why,en,US,success
speech therapy,why speech therapy for kids,4,prefix,why,en,US,success
speech therapy,why speech therapy is needed,5,prefix,why,en,US,success
speech therapy,why speech therapy after stroke,6,prefix,why,en,US,success
speech therapy,why speech therapy for autism,7,prefix,why,en,US,success
speech therapy,what is speech therapy for child,9,prefix,why,en,US,success
speech therapy,where speech therapy questions,1,prefix,where,en,US,success
speech therapy,where speech therapy,2,prefix,where,en,US,success
speech therapy,where to study speech therapy,3,prefix,where,en,US,success
speech therapy,where activities for speech therapy,4,prefix,where,en,US,success
speech therapy,where cards for speech therapy,5,prefix,where,en,US,success
speech therapy,where to start with speech therapy,6,prefix,where,en,US,success
speech therapy,how to learn speech therapy,7,prefix,where,en,US,success
speech therapy,how to say s speech therapy,8,prefix,where,en,US,success
speech therapy,free speech therapy apps,1,prefix,free,en,US,success
speech therapy,free speech therapy,2,prefix,free,en,US,success
speech therapy,free speech therapy for toddlers,3,prefix,free,en,US,success
speech therapy,free speech therapy near me,4,prefix,free,en,US,success
speech therapy,free speech therapy ceus,5,prefix,free,en,US,success
speech therapy,free speech therapy apps for kids,6,prefix,free,en,US,success
speech therapy,free speech therapy apps for toddlers,7,prefix,free,en,US,success
speech therapy,free speech therapy for adults,8,prefix,free,en,US,success
speech therapy,free speech therapy for toddlers near me,9,prefix,free,en,US,success
speech therapy,free speech therapy games,10,prefix,free,en,US,success
speech therapy,when speech therapy is needed,1,prefix,when,en,US,success
speech therapy,when speech therapy for toddler,2,prefix,when,en,US,success
speech therapy,when speech therapy questions,3,prefix,when,en,US,success
speech therapy,when speech therapy,4,prefix,when,en,US,success
speech therapy,when is speech therapy month,5,prefix,when,en,US,success
speech therapy,when is speech therapy day,6,prefix,when,en,US,success
speech therapy,when start speech therapy,7,prefix,when,en,US,success
speech therapy,when to stop speech therapy,8,prefix,when,en,US,success
speech therapy,when should speech therapy start,9,prefix,when,en,US,success
speech therapy,what to expect from speech therapy,10,prefix,when,en,US,success
speech therapy,cheap speech therapy near me,1,prefix,cheap,en,US,success
speech therapy,cheap speech therapy,2,prefix,cheap,en,US,success
speech therapy,cheap speech therapy materials,3,prefix,cheap,en,US,success
speech therapy,cheap speech therapy shirts,4,prefix,cheap,en,US,success
speech therapy,cheap speech therapy online,5,prefix,cheap,en,US,success
speech therapy,cheapest speech therapy,6,prefix,cheap,en,US,success
speech therapy,affordable speech therapy singapore,7,prefix,cheap,en,US,success
speech therapy,affordable speech therapy,8,prefix,cheap,en,US,success
speech therapy,low cost speech therapy near me,9,prefix,cheap,en,US,success
speech therapy,affordable speech therapy near me,10,prefix,cheap,en,US,success
speech therapy,speech therapy online,1,suffix,online,en,US,success
speech therapy,speech therapy online free,2,suffix,online,en,US,success
speech therapy,speech therapy online for kids,3,suffix,online,en,US,success
speech therapy,speech therapy online programs,4,suffix,online,en,US,success
speech therapy,speech therapy online games,5,suffix,online,en,US,success
speech therapy,speech therapy online free for adults,6,suffix,online,en,US,success
speech therapy,speech therapy online course free,7,suffix,online,en,US,success
speech therapy,speech therapy online for adults,8,suffix,online,en,US,success
speech therapy,speech therapy online degree,9,suffix,online,en,US,success
speech therapy,speech therapy online jobs,10,suffix,online,en,US,success
speech therapy,speech pathology 2025,1,suffix,2025,en,US,success
speech therapy,speech therapy month 2025,2,suffix,2025,en,US,success
speech therapy,speech therapy day 2025,3,suffix,2025,en,US,success
speech therapy,speech therapy week 2025,4,suffix,2025,en,US,success
speech therapy,speech therapy conferences 2025,5,suffix,2025,en,US,success
speech therapy,speech therapy rates 2025,6,suffix,2025,en,US,success
speech therapy,rfp speech therapy 2025,7,suffix,2025,en,US,success
speech therapy,speech and language therapy 2025,8,suffix,2025,en,US,success
speech therapy,speech therapist day 2025,9,suffix,2025,en,US,success
speech therapy,speech therapist week 2025,10,suffix,2025,en,US,success
speech therapy,speech therapy free,1,suffix,free,en,US,success
speech therapy,speech therapy free near me,2,suffix,free,en,US,success
speech therapy,speech therapy free for kids,3,suffix,free,en,US,success
speech therapy,speech therapy free online,4,suffix,free,en,US,success
speech therapy,speech therapy free apps,5,suffix,free,en,US,success
speech therapy,speech therapy free resources,6,suffix,free,en,US,success
speech therapy,speech therapy free worksheets,7,suffix,free,en,US,success
speech therapy,speech therapy free games,8,suffix,free,en,US,success
speech therapy,speech therapy free materials,9,suffix,free,en,US,success
speech therapy,speech therapy freehold nj,10,suffix,free,en,US,success
speech therapy,speech therapy tutorial,1,suffix,tutorial,en,US,success
speech therapy,speech therapy lesson plan template,2,suffix,tutorial,en,US,success
speech therapy,speech therapy lesson plans,3,suffix,tutorial,en,US,success
speech therapy,speech therapy lesson plans pdf,4,suffix,tutorial,en,US,success
speech therapy,speech therapy guide for parents,5,suffix,tutorial,en,US,success
speech therapy,speech therapy lesson,6,suffix,tutorial,en,US,success
speech therapy,speech therapy guide,7,suffix,tutorial,en,US,success
speech therapy,speech therapy lesson plans for autism,8,suffix,tutorial,en,US,success
speech therapy,speech therapy lesson plan example,9,suffix,tutorial,en,US,success
speech therapy,speech therapy lesson plan template free,10,suffix,tutorial,en,US,success
speech therapy,online speech therapy,1,prefix,online,en,US,success
speech therapy,online speech therapy for kids,2,prefix,online,en,US,success
speech therapy,online speech therapy programs,3,prefix,online,en,US,success
speech therapy,online speech therapy for adults,4,prefix,online,en,US,success
speech therapy,online speech therapy games,5,prefix,online,en,US,success
speech therapy,online speech therapy jobs,6,prefix,online,en,US,success
speech therapy,online speech therapy degree,7,prefix,online,en,US,success
speech therapy,online speech therapy that takes insurance,8,prefix,online,en,US,success
speech therapy,online speech therapy for kids free,9,prefix,online,en,US,success
speech therapy,online speech therapy free,10,prefix,online,en,US,success
speech therapy,speech therapy near me for kids,4,suffix,near me,en,US,success
speech therapy,speech therapy near me for adults,5,suffix,near me,en,US,success
speech therapy,speech therapy near me that accepts medicaid,6,suffix,near me,en,US,success
speech therapy,speech therapy near me for toddler,7,suffix,near me,en,US,success
speech therapy,speech therapy near me within 5 mi,8,suffix,near me,en,US,success
speech therapy,speech therapy near me pediatric,9,suffix,near me,en,US,success
speech therapy,speech therapy near me open now,10,suffix,near me,en,US,success
speech therapy,speech therapy reddit,1,suffix,reddit,en,US,success
speech therapy,speech therapy redditch,2,suffix,reddit,en,US,success
speech therapy,speech therapy reddit ph,3,suffix,reddit,en,US,success
speech therapy,speech therapy reddit adult,4,suffix,reddit,en,US,success
speech therapy,speech therapist reddit,5,suffix,reddit,en,US,success
speech therapy,speech pathologist reddit,6,suffix,reddit,en,US,success
speech therapy,speech pathology reddit,7,suffix,reddit,en,US,success
speech therapy,voice therapy reddit,8,suffix,reddit,en,US,success
speech therapy,speech pathology reddit australia,9,suffix,reddit,en,US,success
speech therapy,speech pathology reddit ph,10,suffix,reddit,en,US,success
speech therapy,speech therapy tips,1,suffix,tips,en,US,success
speech therapy,speech therapy tips for parents,2,suffix,tips,en,US,success
speech therapy,speech therapy tips for toddlers,3,suffix,tips,en,US,success
speech therapy,speech therapy tips at home,4,suffix,tips,en,US,success
speech therapy,speech therapy tips for 2 year old,5,suffix,tips,en,US,success
speech therapy,speech therapy tips for parents to use at home,6,suffix,tips,en,US,success
speech therapy,speech therapy tips for 3 year olds,7,suffix,tips,en,US,success
speech therapy,speech therapy tips for adults,8,suffix,tips,en,US,success
speech therapy,speech therapy tips for 18 month old,9,suffix,tips,en,US,success
speech therapy,speech therapy tips for 15 month old,10,suffix,tips,en,US,success
speech therapy,speech therapy for beginners,1,suffix,for beginners,en,US,success
speech therapy,speech therapy for dummies,2,suffix,for beginners,en,US,success
speech therapy,when should i start speech therapy,3,suffix,for beginners,en,US,success
speech therapy,how do i do speech therapy at home,4,suffix,for beginners,en,US,success
speech therapy,how to start speech therapy,6,suffix,for beginners,en,US,success
speech therapy,can i do speech therapy at home,7,suffix,for beginners,en,US,success
speech therapy,speech therapy guidelines,1,suffix,guide,en,US,success
speech therapy,speech therapy guide book,4,suffix,guide,en,US,success
speech therapy,speech therapy guide pdf,5,suffix,guide,en,US,success
speech therapy,speech therapy guide for 2 year olds,6,suffix,guide,en,US,success
speech therapy,speech and language guidelines,7,suffix,guide,en,US,success
speech therapy,speech pathology guidelines,8,suffix,guide,en,US,success
speech therapy,speech therapy manual pdf,9,suffix,guide,en,US,success
speech therapy,speech therapy handbook,10,suffix,guide,en,US,success
speech therapy,speech therapy dc,1,alphabet,d,en,US,success
speech therapy,speech therapy degree,2,alphabet,d,en,US,success
speech therapy,speech therapy definition,3,alphabet,d,en,US,success
speech therapy,speech therapy diagnosis codes,4,alphabet,d,en,US,success
speech therapy,speech therapy degree online,5,alphabet,d,en,US,success
speech therapy,speech therapy degree requirements,6,alphabet,d,en,US,success
speech therapy,speech therapy data sheets,7,alphabet,d,en,US,success
speech therapy,speech therapy devices,8,alphabet,d,en,US,success
speech therapy,speech therapy day,9,alphabet,d,en,US,success
speech therapy,speech therapy data collection sheets,10,alphabet,d,en,US,success
speech therapy,speech therapy cpt codes,1,alphabet,c,en,US,success
speech therapy,speech therapy calvert county,2,alphabet,c,en,US,success
speech therapy,speech therapy clinton md,3,alphabet,c,en,US,success
speech therapy,speech therapy cost,4,alphabet,c,en,US,success
speech therapy,speech therapy cumberland md,5,alphabet,c,en,US,success
speech therapy,speech therapy culpeper va,6,alphabet,c,en,US,success
speech therapy,speech therapy clinics near me,7,alphabet,c,en,US,success
speech therapy,speech therapy columbia md,8,alphabet,c,en,US,success
speech therapy,speech therapy chambersburg pa,9,alphabet,c,en,US,success
speech therapy,speech therapy career path,10,alphabet,c,en,US,success
speech therapy,speech therapy bowie md,1,alphabet,b,en,US,success
speech therapy,speech therapy bethesda,2,alphabet,b,en,US,success
speech therapy,speech therapy books,3,alphabet,b,en,US,success
speech therapy,speech therapy books for toddlers,4,alphabet,b,en,US,success
speech therapy,speech therapy billing codes,5,alphabet,b,en,US,success
speech therapy,speech therapy bag,6,alphabet,b,en,US,success
speech therapy,speech therapy books for kids,7,alphabet,b,en,US,success
speech therapy,speech therapy benefits,8,alphabet,b,en,US,success
speech therapy,speech therapy bachelor's degree,9,alphabet,b,en,US,success
speech therapy,speech therapy badge reel,10,alphabet,b,en,US,success
speech therapy,speech therapy reviews,1,suffix,review,en,US,success
speech therapy,speech therapy reviewer jobs remote,2,suffix,review,en,US,success
speech therapy,speech therapy reviewer jobs,3,suffix,review,en,US,success
speech therapy,speech therapist reviews,4,suffix,review,en,US,success
speech therapy,speech pathology review,5,suffix,review,en,US,success
speech therapy,speech pathologist reviews,6,suffix,review,en,US,success
speech therapy,expressable speech therapy reviews,7,suffix,review,en,US,success
speech therapy,magpie speech therapy reviews,8,suffix,review,en,US,success
speech therapy,amazing speech therapy reviews,9,suffix,review,en,US,success
speech therapy,speech therapy plus reviews,10,suffix,review,en,US,success
speech therapy,speech therapy arlington va,2,alphabet,a,en,US,success
speech therapy,speech therapy adults,3,alphabet,a,en,US,success
speech therapy,speech therapy ashburn va,4,alphabet,a,en,US,success
speech therapy,speech therapy at home for kids,5,alphabet,a,en,US,success
speech therapy,speech therapy at home,6,alphabet,a,en,US,success
speech therapy,speech therapy apps,7,alphabet,a,en,US,success
speech therapy,speech therapy assistant,8,alphabet,a,en,US,success
speech therapy,speech therapy and occupational therapy near me,9,alphabet,a,en,US,success
speech therapy,speech therapy at home for 3 year old,10,alphabet,a,en,US,success
speech therapy,speech therapy enterprises llc,1,alphabet,e,en,US,success
speech therapy,speech therapy exercises,2,alphabet,e,en,US,success
speech therapy,speech therapy evaluation,3,alphabet,e,en,US,success
speech therapy,speech therapy exercises for adults,4,alphabet,e,en,US,success
speech therapy,speech therapy evaluation cpt code,5,alphabet,e,en,US,success
speech therapy,speech therapy exercises for stroke patients pdf,6,alphabet,e,en,US,success
speech therapy,speech therapy exercises for toddlers,7,alphabet,e,en,US,success
speech therapy,speech therapy early intervention,8,alphabet,e,en,US,success
speech therapy,speech therapy education,9,alphabet,e,en,US,success
speech therapy,speech therapy exercises for kids,10,alphabet,e,en,US,success
speech therapy,speech therapy fairfax,6,alphabet,f,en,US,success
speech therapy,speech therapy for kids near me,7,alphabet,f,en,US,success
speech therapy,speech therapy fairfax va,8,alphabet,f,en,US,success
speech therapy,speech therapy for toddlers near me,9,alphabet,f,en,US,success
speech therapy,speech therapy for 2 year old,10,alphabet,f,en,US,success
speech therapy,speech therapy in spanish,1,alphabet,i,en,US,success
speech therapy,speech therapy inova,2,alphabet,i,en,US,success
speech therapy,speech therapy in laurel md,3,alphabet,i,en,US,success
speech therapy,speech therapy in schools,4,alphabet,i,en,US,success
speech therapy,speech therapy in lanham,5,alphabet,i,en,US,success
speech therapy,speech therapy in maryland,6,alphabet,i,en,US,success
speech therapy,speech therapy icd 10 codes,7,alphabet,i,en,US,success
speech therapy,speech therapy in home,8,alphabet,i,en,US,success
speech therapy,speech therapy icon,9,alphabet,i,en,US,success
speech therapy,speech therapy internships,10,alphabet,i,en,US,success
speech therapy,speech therapy herndon va,1,alphabet,h,en,US,success
speech therapy,speech therapy halloween costumes,2,alphabet,h,en,US,success
speech therapy,speech therapy halloween shirt,3,alphabet,h,en,US,success
speech therapy,speech therapy halloween activities,4,alphabet,h,en,US,success
speech therapy,speech therapy home health,5,alphabet,h,en,US,success
speech therapy,speech therapy halloween craft,6,alphabet,h,en,US,success
speech therapy,speech therapy helps with,7,alphabet,h,en,US,success
speech therapy,speech therapy how to become,8,alphabet,h,en,US,success
speech therapy,speech therapy homework,9,alphabet,h,en,US,success
speech therapy,speech therapy home service,10,alphabet,h,en,US,success
speech therapy,speech therapy germantown md,1,alphabet,g,en,US,success
speech therapy,speech therapy gaithersburg md,2,alphabet,g,en,US,success
speech therapy,speech therapy games,3,alphabet,g,en,US,success
speech therapy,speech therapy goals,4,alphabet,g,en,US,success
speech therapy,speech therapy goal bank,5,alphabet,g,en,US,success
speech therapy,speech therapy graduation certificate,6,alphabet,g,en,US,success
speech therapy,speech therapy gifts,7,alphabet,g,en,US,success
speech therapy,speech therapy games for kids,8,alphabet,g,en,US,success
speech therapy,speech therapy goals for autism,9,alphabet,g,en,US,success
speech therapy,speech therapy games online,10,alphabet,g,en,US,success
speech therapy,speech therapy laurel md,1,alphabet,l,en,US,success
speech therapy,speech therapy lanham md,2,alphabet,l,en,US,success
speech therapy,speech therapy la plata md,3,alphabet,l,en,US,success
speech therapy,speech therapy license lookup,4,alphabet,l,en,US,success
speech therapy,speech therapy license,5,alphabet,l,en,US,success
speech therapy,speech therapy logos,6,alphabet,l,en,US,success
speech therapy,speech therapy lessons,9,alphabet,l,en,US,success
speech therapy,speech therapy license renewal,10,alphabet,l,en,US,success
speech therapy,speech therapy manassas va,1,alphabet,m,en,US,success
speech therapy,speech therapy martinsburg wv,2,alphabet,m,en,US,success
speech therapy,speech therapy month,3,alphabet,m,en,US,success
speech therapy,speech therapy meaning,4,alphabet,m,en,US,success
speech therapy,speech therapy materials,5,alphabet,m,en,US,success
speech therapy,speech therapy montgomery county md,6,alphabet,m,en,US,success
speech therapy,speech therapy maryland,7,alphabet,m,en,US,success
speech therapy,speech therapy medicaid,8,alphabet,m,en,US,success
speech therapy,speech therapy major,9,alphabet,m,en,US,success
speech therapy,speech therapy masters,10,alphabet,m,en,US,success
speech therapy,speech therapy northern virginia,5,alphabet,n,en,US,success
speech therapy,speech therapy nearby,9,alphabet,n,en,US,success
speech therapy,speech therapy jobs near me,1,alphabet,j,en,US,success
speech therapy,speech therapy jobs,2,alphabet,j,en,US,success
speech therapy,speech therapy jobs washington dc,3,alphabet,j,en,US,success
speech therapy,speech therapy jobs remote,4,alphabet,j,en,US,success
speech therapy,speech therapy jokes,5,alphabet,j,en,US,success
speech therapy,speech therapy job description,6,alphabet,j,en,US,success
speech therapy,speech therapy jobs in canada,7,alphabet,j,en,US,success
speech therapy,speech therapy jobs in ireland,8,alphabet,j,en,US,success
speech therapy,speech therapy jacksonville fl,9,alphabet,j,en,US,success
speech therapy,speech therapy jobs abroad,10,alphabet,j,en,US,success
speech therapy,speech therapy kids,1,alphabet,k,en,US,success
speech therapy,speech therapy kids near me,2,alphabet,k,en,US,success
speech therapy,speech therapy kindergarten,3,alphabet,k,en,US,success
speech therapy,speech therapy kit,4,alphabet,k,en,US,success
speech therapy,speech therapy kaiser,5,alphabet,k,en,US,success
speech therapy,speech therapy kissimmee fl,6,alphabet,k,en,US,success
speech therapy,speech therapy k sound,7,alphabet,k,en,US,success
speech therapy,speech therapy k words,8,alphabet,k,en,US,success
speech therapy,speech therapy kissimmee,9,alphabet,k,en,US,success
speech therapy,speech therapy kids online,10,alphabet,k,en,US,success
speech therapy,speech therapy rockville,1,alphabet,r,en,US,success
speech therapy,speech therapy rockville md,2,alphabet,r,en,US,success
speech therapy,speech therapy resources,3,alphabet,r,en,US,success
speech therapy,speech therapy requirements,4,alphabet,r,en,US,success
speech therapy,speech therapy referral,5,alphabet,r,en,US,success
speech therapy,speech therapy room decor,6,alphabet,r,en,US,success
speech therapy,speech therapy room,8,alphabet,r,en,US,success
speech therapy,speech therapy r sound,9,alphabet,r,en,US,success
speech therapy,speech therapy remote jobs,10,alphabet,r,en,US,success
speech therapy,speech therapy outpatient,4,alphabet,o,en,US,success
speech therapy,speech therapy office,8,alphabet,o,en,US,success
speech therapy,speech therapy on youtube,9,alphabet,o,en,US,success
speech therapy,speech therapy occupational therapy,10,alphabet,o,en,US,success
speech therapy,speech therapy pd,1,alphabet,p,en,US,success
speech therapy,speech therapy pediatric near me,2,alphabet,p,en,US,success
speech therapy,speech therapy programs,3,alphabet,p,en,US,success
speech therapy,speech therapy prince william county,4,alphabet,p,en,US,success
speech therapy,speech therapy parkinson's,5,alphabet,p,en,US,success
speech therapy,speech therapy pediatric,6,alphabet,p,en,US,success
speech therapy,speech therapy programs near me,7,alphabet,p,en,US,success
speech therapy,speech therapy pathologist,8,alphabet,p,en,US,success
speech therapy,speech therapy pay,9,alphabet,p,en,US,success
speech therapy,speech therapy picture scenes,10,alphabet,p,en,US,success
speech therapy,speech therapy salary,1,alphabet,s,en,US,success
speech therapy,speech therapy silver spring,2,alphabet,s,en,US,success
speech therapy,speech therapy springfield va,3,alphabet,s,en,US,success
speech therapy,speech therapy school,4,alphabet,s,en,US,success
speech therapy,speech therapy sterling va,5,alphabet,s,en,US,success
speech therapy,speech therapy shirts,6,alphabet,s,en,US,success
speech therapy,speech therapy school near me,7,alphabet,s,en,US,success
speech therapy,speech therapy sweatshirt,8,alphabet,s,en,US,success
speech therapy,speech therapy services,9,alphabet,s,en,US,success
speech therapy,speech therapy services near me,10,alphabet,s,en,US,success
speech therapy,speech therapy quotes,1,alphabet,q,en,US,success
speech therapy,speech therapy qualifications,2,alphabet,q,en,US,success
speech therapy,speech therapy quotes funny,3,alphabet,q,en,US,success
speech therapy,speech therapy quiz,4,alphabet,q,en,US,success
speech therapy,speech therapy questions to ask,5,alphabet,q,en,US,success
speech therapy,speech therapy questions,6,alphabet,q,en,US,success
speech therapy,speech therapy questions for kids,7,alphabet,q,en,US,success
speech therapy,speech therapy quotes for students,8,alphabet,q,en,US,success
