种子关键词,下拉词建议,排名,扩展类型,扩展词,语言,地区,状态
speech therapy,speech therapy questions for adults,9,alphabet,q,en,US,success
speech therapy,speech therapy queens,10,alphabet,q,en,US,success
speech therapy,speech therapy toys,1,alphabet,t,en,US,success
speech therapy,speech therapy techniques,2,alphabet,t,en,US,success
speech therapy,speech therapy toddler,3,alphabet,t,en,US,success
speech therapy,speech therapy tools,4,alphabet,t,en,US,success
speech therapy,speech therapy toddler near me,5,alphabet,t,en,US,success
speech therapy,speech therapy that accepts medicaid,6,alphabet,t,en,US,success
speech therapy,speech therapy t shirts,7,alphabet,t,en,US,success
speech therapy,speech therapy toys for 2 year old,8,alphabet,t,en,US,success
speech therapy,speech therapy taxonomy code,9,alphabet,t,en,US,success
speech therapy,speech therapy toys for toddlers,10,alphabet,t,en,US,success
speech therapy,speech therapy utilization review jobs remote,1,alphabet,u,en,US,success
speech therapy,speech therapy utilization review jobs,2,alphabet,u,en,US,success
speech therapy,speech therapy uses,3,alphabet,u,en,US,success
speech therapy,speech therapy university,4,alphabet,u,en,US,success
speech therapy,speech therapy union,5,alphabet,u,en,US,success
speech therapy,speech therapy undergraduate,6,alphabet,u,en,US,success
speech therapy,speech therapy uva,7,alphabet,u,en,US,success
speech therapy,speech therapy undergraduate programs,8,alphabet,u,en,US,success
speech therapy,speech therapy union city,9,alphabet,u,en,US,success
speech therapy,speech therapy umd,10,alphabet,u,en,US,success
speech therapy,speech therapy winchester va,2,alphabet,w,en,US,success
speech therapy,speech therapy washington dc,4,alphabet,w,en,US,success
speech therapy,speech therapy warrenton va,5,alphabet,w,en,US,success
speech therapy,speech therapy woodbridge va,6,alphabet,w,en,US,success
speech therapy,speech therapy winchester,7,alphabet,w,en,US,success
speech therapy,speech therapy worksheets,8,alphabet,w,en,US,success
speech therapy,speech therapy words,9,alphabet,w,en,US,success
speech therapy,speech therapy websites,10,alphabet,w,en,US,success
speech therapy,speech therapy x ray,1,alphabet,x,en,US,success
speech therapy,speech therapy x,2,alphabet,x,en,US,success
speech therapy,speech pathology x ray,3,alphabet,x,en,US,success
speech therapy,speech pathology xula,4,alphabet,x,en,US,success
speech therapy,speech pathology xavier,5,alphabet,x,en,US,success
speech therapy,mommy speech therapy x,6,alphabet,x,en,US,success
speech therapy,speech therapy for fragile x syndrome,7,alphabet,x,en,US,success
speech therapy,xqc speech therapy,8,alphabet,x,en,US,success
speech therapy,xerostomia speech therapy,9,alphabet,x,en,US,success
speech therapy,xavier speech therapy,10,alphabet,x,en,US,success
speech therapy,speech therapy vs occupational therapy,1,alphabet,v,en,US,success
speech therapy,speech therapy vs speech pathology,2,alphabet,v,en,US,success
speech therapy,speech therapy videos,3,alphabet,v,en,US,success
speech therapy,speech therapy videos for adults,4,alphabet,v,en,US,success
speech therapy,speech therapy videos for kids,5,alphabet,v,en,US,success
speech therapy,speech therapy videos for 5 year old,6,alphabet,v,en,US,success
speech therapy,speech therapy virtual,7,alphabet,v,en,US,success
speech therapy,speech therapy visuals,8,alphabet,v,en,US,success
speech therapy,speech therapy visual schedule,9,alphabet,v,en,US,success
speech therapy,speech therapy vocabulary goals,10,alphabet,v,en,US,success
speech therapy,speech therapy z words,1,alphabet,z,en,US,success
speech therapy,speech therapy zeeland mi,2,alphabet,z,en,US,success
speech therapy,speech therapy zoom background,3,alphabet,z,en,US,success
speech therapy,speech therapy zone,4,alphabet,z,en,US,success
speech therapy,speech therapy z sound,5,alphabet,z,en,US,success
speech therapy,speech therapy zachary la,6,alphabet,z,en,US,success
speech therapy,speech therapy zebulon nc,7,alphabet,z,en,US,success
speech therapy,speech therapy zanesville ohio,8,alphabet,z,en,US,success
speech therapy,speech therapy zephyrhills,9,alphabet,z,en,US,success
speech therapy,speech therapy zephyrhills fl,10,alphabet,z,en,US,success
speech therapy,speech therapy youtube,1,alphabet,y,en,US,success
speech therapy,speech therapy youtube videos,2,alphabet,y,en,US,success
speech therapy,speech therapy yes no questions,3,alphabet,y,en,US,success
speech therapy,speech therapy ymca,4,alphabet,y,en,US,success
speech therapy,speech therapy yes/no questions,5,alphabet,y,en,US,success
speech therapy,speech therapy york pa,6,alphabet,y,en,US,success
speech therapy,speech therapy york hospital,7,alphabet,y,en,US,success
speech therapy,speech therapy yuma az,8,alphabet,y,en,US,success
speech therapy,speech therapy yale,9,alphabet,y,en,US,success
speech therapy,speech therapy yuma,10,alphabet,y,en,US,success
speech therapy,can speech therapy help with stuttering,1,question,can,en,US,success
speech therapy,can speech therapy help with memory,2,question,can,en,US,success
speech therapy,can speech therapy fix a lisp,3,question,can,en,US,success
speech therapy,can speech therapy help with swallowing,4,question,can,en,US,success
speech therapy,can speech therapy help with dyslexia,5,question,can,en,US,success
speech therapy,can speech therapy help with a lisp,6,question,can,en,US,success
speech therapy,can speech therapy be covered by insurance,7,question,can,en,US,success
speech therapy,can speech therapy help with aphasia,8,question,can,en,US,success
speech therapy,can speech therapy help with echolalia,9,question,can,en,US,success
speech therapy,can speech therapy help adults,10,question,can,en,US,success
speech therapy,which language speech,3,question,which,en,US,success
speech therapy,who can benefit from speech therapy,4,question,which,en,US,success
speech therapy,who speech therapy questions,1,question,who,en,US,success
speech therapy,who speech therapy,2,question,who,en,US,success
speech therapy,who activities speech therapy,3,question,who,en,US,success
speech therapy,who benefits from speech therapy,4,question,who,en,US,success
speech therapy,who is speech and language therapy for,5,question,who,en,US,success
speech therapy,who invented speech therapy,7,question,who,en,US,success
speech therapy,does speech therapy work,1,question,does,en,US,success
speech therapy,does speech therapy help with memory,2,question,does,en,US,success
speech therapy,does speech therapy help with stuttering,3,question,does,en,US,success
speech therapy,does speech therapy help with dyslexia,4,question,does,en,US,success
speech therapy,does speech therapy help,5,question,does,en,US,success
speech therapy,does speech therapy help with eating,6,question,does,en,US,success
speech therapy,does speech therapy help with dementia,7,question,does,en,US,success
speech therapy,does speech therapy work for toddlers,8,question,does,en,US,success
speech therapy,does speech therapy help with reading,9,question,does,en,US,success
speech therapy,does speech therapy actually work,10,question,does,en,US,success
speech therapy,should speech therapy be capitalized,1,question,should,en,US,success
speech therapy,can speech therapy cure stammering,6,question,should,en,US,success
speech therapy,will speech therapy help my child talk,9,question,should,en,US,success
speech therapy,will speech therapy help my child,10,question,should,en,US,success
speech therapy,how much speech therapy cost,1,question,how much,en,US,success
speech therapy,how much speech therapy is too much,2,question,how much,en,US,success
speech therapy,how much speech therapy for autism,3,question,how much,en,US,success
speech therapy,how much speech therapy is enough,4,question,how much,en,US,success
speech therapy,how much speech therapy cost philippines,5,question,how much,en,US,success
speech therapy,how much speech therapy,6,question,how much,en,US,success
speech therapy,how much speech therapy make,7,question,how much,en,US,success
speech therapy,how much speech therapy does medicaid cover,8,question,how much,en,US,success
speech therapy,how many speech therapy sessions per week,9,question,how much,en,US,success
speech therapy,how many speech therapy sessions,10,question,how much,en,US,success
speech therapy,what is it speech therapy,1,question,is it,en,US,success
speech therapy,is speech therapy covered by insurance,2,question,is it,en,US,success
speech therapy,is speech therapy an iep,3,question,is it,en,US,success
speech therapy,is speech therapy free,4,question,is it,en,US,success
speech therapy,is speech therapy free for toddlers,5,question,is it,en,US,success
speech therapy,is speech therapy early intervention,6,question,is it,en,US,success
speech therapy,is speech therapy occupational,7,question,is it,en,US,success
speech therapy,is speech therapy ot,8,question,is it,en,US,success
speech therapy,is speech therapy for autism,9,question,is it,en,US,success
speech therapy,is speech therapy a doctor,10,question,is it,en,US,success
speech therapy,will speech therapy be replaced by ai,1,question,will,en,US,success
speech therapy,will speech therapy help my autistic child,3,question,will,en,US,success
speech therapy,will speech therapy help with stuttering,4,question,will,en,US,success
speech therapy,is speech therapy covered by ohip,8,question,will,en,US,success
speech therapy,is speech therapy considered special education,9,question,will,en,US,success
speech therapy,is speech therapy covered by medicare,10,question,will,en,US,success
speech therapy,how many speech therapy sessions are needed,2,question,how many,en,US,success
speech therapy,how many speech therapy sessions does medicare cover,3,question,how many,en,US,success
speech therapy,how many speech therapy,5,question,how many,en,US,success
speech therapy,best way to speech therapy,1,question,best way to,en,US,success
speech therapy,best way to organize speech therapy materials,2,question,best way to,en,US,success
speech therapy,best way to improve speech therapy,3,question,best way to,en,US,success
speech therapy,best place to study speech therapy,4,question,best way to,en,US,success
speech therapy,tips for speech therapy at home,6,question,best way to,en,US,success
speech therapy,how to improve speech therapy,7,question,best way to,en,US,success
speech therapy,how to do speech therapy at home,8,question,best way to,en,US,success
speech therapy,how to pay for speech therapy,9,question,best way to,en,US,success